number,value,datetime_start,datetime_complete,duration,params_batch_size,params_class_weighting,params_cnn_channels,params_dropout,params_focal_gamma,params_freq_mask_param,params_hidden_size,params_label_smoothing,params_learning_rate,params_loss_type,params_max_grad_norm,params_min_lr_ratio,params_mixup_alpha,params_mixup_prob,params_num_freq_masks,params_num_layers,params_num_time_masks,params_scheduler_type,params_speed_perturb_max,params_speed_perturb_min,params_speed_perturb_prob,params_time_mask_param,params_warmup_epochs,params_weight_decay,user_attrs_repeat_best_f1s,user_attrs_repeat_best_losses,user_attrs_repeat_mean_f1,user_attrs_repeat_robust_score,user_attrs_repeat_std_f1,state
48,0.61258311482319,2026-05-02 23:38:07.203583,2026-05-02 23:40:20.723621,0 days 00:02:13.520038,32,True,48,0.20321831599597695,,4,320,0.08602546832161378,0.0007872667340408727,ce,0.5951524489916551,0.1301722033851047,0.1724576149520331,0.39005753304305707,1,1,1,warmup_cosine,1.1,0.9,0.06713228920971512,20,2,0.00036253559321609906,"[0.6093670942397855, 0.6222311765734031]","[1.2108388298707042, 1.2072784899235915]",0.6157991354065944,0.61258311482319,0.0064320411668087885,COMPLETE
49,0.6069074197867336,2026-05-02 23:40:20.835463,2026-05-02 23:42:35.368359,0 days 00:02:14.532896,32,True,48,0.20382406177136195,,4,256,0.08435732828929428,0.0009985783001689326,ce,0.5971980833809141,0.1900747390092975,0.16340152085327392,0.2716675741023528,1,1,1,warmup_cosine,1.1,0.9,0.0709635212927576,20,2,0.0002522526849856082,"[0.6058708111580349, 0.6100172456728296]","[1.1899878604234837, 1.182590950021355]",0.6079440284154323,0.6069074197867336,0.0020732172573973418,COMPLETE
50,0.614914343968408,2026-05-02 23:42:35.491695,2026-05-02 23:44:48.664313,0 days 00:02:13.172618,32,True,48,0.20513623855290725,,4,256,0.05791147331564986,0.0007827843886129866,ce,0.705788572137176,0.22246213184132071,0.18223434616919,0.271852988215646,1,1,1,warmup_cosine,1.1,0.9,0.07081653531544363,20,2,0.00027728463159705703,"[0.6103488729899665, 0.6286107569037329]","[1.1728541728118056, 1.1483975987640216]",0.6194798149468497,0.614914343968408,0.009130941956883187,COMPLETE
51,0.6119467758522235,2026-05-02 23:44:48.778549,2026-05-02 23:47:02.663589,0 days 00:02:13.885040,32,True,48,0.20125761873064857,,4,256,0.05913053315824102,0.0007786131680933789,ce,0.7104478276671685,0.22206876870567305,0.1782376971631852,0.22064807127176905,1,1,1,warmup_cosine,1.1,0.9,0.06756615992098862,20,2,0.0002564571812855232,"[0.6293735021261179, 0.6061378670942587]","[1.1516878364755094, 1.1726367750899682]",0.6177556846101883,0.6119467758522235,0.011617817515929607,COMPLETE
52,0.6152998142743468,2026-05-02 23:47:02.784197,2026-05-02 23:49:16.065989,0 days 00:02:13.281792,32,True,48,0.20224790657389607,,4,256,0.05465261351237854,0.0007881165266253214,ce,0.6940656989662916,0.22192408464596616,0.17833835975927492,0.21083622333880098,1,1,1,warmup_cosine,1.1,0.9,0.07121970965745573,20,2,0.00024790816506811475,"[0.6118546978505289, 0.6256351635458003]","[1.138328264085509, 1.124574640529047]",0.6187449306981646,0.6152998142743468,0.00689023284763568,COMPLETE
53,0.6197010065094442,2026-05-02 23:49:16.180442,2026-05-02 23:51:29.752097,0 days 00:02:13.571655,32,True,48,0.20477396261695455,,4,256,0.055977612307134175,0.0007778576068292312,ce,0.6964361585399291,0.21798881469860854,0.18862678955069756,0.20416016504724124,1,1,1,warmup_cosine,1.1,0.9,0.1142177501408472,16,2,0.00015529057841393577,"[0.6156035517406986, 0.6319933708156811]","[1.163643546527524, 1.1468310214632707]",0.6237984612781898,0.6197010065094442,0.008194909537491246,COMPLETE
54,0.5593203706570888,2026-05-02 23:51:29.868919,2026-05-02 23:52:15.835049,0 days 00:00:45.966130,32,True,48,0.20044529581014364,,4,256,0.05558985114557793,0.0007749322254419247,ce,0.6949390666478145,0.22279407944334464,0.1913074843840537,0.19793476639752092,1,1,1,warmup_cosine,1.1,0.9,0.11309042358128528,16,2,0.00017049406747842967,,,,,,PRUNED
55,0.47511674321097647,2026-05-02 23:52:15.953486,2026-05-02 23:52:44.975266,0 days 00:00:29.021780,32,True,48,0.2169449168214087,,4,256,0.04377909761576136,0.000779245660663261,ce,0.7388897678938818,0.22503057979793178,0.13835518110306155,0.21876246983684797,1,1,1,warmup_cosine,1.1,0.9,0.08352739264646795,20,2,0.00022133093088038525,,,,,,PRUNED
56,0.482946896600792,2026-05-02 23:52:45.085009,2026-05-02 23:53:14.528360,0 days 00:00:29.443351,32,True,48,0.22660049623503292,,4,256,0.059863589544339395,0.0008661597589664809,ce,0.6831497776530728,0.24893547536458285,0.18234841208933583,0.16012565374964974,1,1,1,warmup_cosine,1.1,0.9,0.0944983953147872,16,2,0.00015313111507892199,,,,,,PRUNED
57,0.6067613109033707,2026-05-02 23:53:14.644920,2026-05-02 23:55:27.867813,0 days 00:02:13.222893,32,True,48,0.2383841859746652,,4,256,0.04627221762801485,0.0007244346094912504,ce,0.8407269667905973,0.210477970555135,0.20276108685830774,0.2448936484061366,1,1,1,warmup_cosine,1.1,0.9,0.14434377171556823,20,3,0.0002736642382505953,"[0.6229267189458407, 0.6013728415558808]","[1.1436900900993987, 1.1545650250048374]",0.6121497802508608,0.6067613109033707,0.010776938694979976,COMPLETE
58,0.45415205443005396,2026-05-02 23:55:27.985514,2026-05-02 23:55:57.364570,0 days 00:00:29.379056,32,True,48,0.21189183047414922,,4,256,0.06640200273374022,0.00017641107133250508,ce,0.8945485356681782,0.25845783762309366,0.147920090008048,0.22016214055276787,1,1,1,warmup_cosine,1.1,0.9,0.10864524303620526,16,2,0.00019226266543894777,,,,,,PRUNED
59,0.5732493556669341,2026-05-02 23:55:57.495814,2026-05-02 23:56:56.041555,0 days 00:00:58.545741,32,True,48,0.22732762800498713,,6,256,0.05111629722122098,0.0006656943347610802,ce,0.7194638700455119,0.24027992447719898,0.1212474264756597,0.18440331793325399,1,1,1,warmup_cosine,1.1,0.9,0.13783799752116838,20,2,0.0001526490588259977,,,,,,PRUNED
60,0.5986777619984518,2026-05-02 23:56:56.152071,2026-05-02 23:59:08.943917,0 days 00:02:12.791846,32,True,48,0.23996355995677782,,4,256,0.03986870570385544,0.0007984766169251591,ce,0.6440740498607985,0.27290861674746414,0.20590050479216235,0.21505804713096446,1,1,1,warmup_cosine,1.1,0.9,0.06431418976683943,20,3,0.0002750597618728625,"[0.6078984138528892, 0.595604211380306]","[1.1330446525157498, 1.1872310518360825]",0.6017513126165976,0.5986777619984518,0.006147101236291641,COMPLETE
61,0.6176112542152361,2026-05-02 23:59:09.060389,2026-05-03 00:01:22.879427,0 days 00:02:13.819038,32,True,48,0.21531225255491984,,4,256,0.05735579184472665,0.0008788678627698109,ce,0.7674391478946646,0.21222569838210462,0.177114392826224,0.16490218873693502,1,1,1,warmup_cosine,1.1,0.9,0.08186680484605435,16,2,0.00013293538593720473,"[0.6473625821734149, 0.6076941448958432]","[1.1149475484443225, 1.1368391588151598]",0.627528363534629,0.6176112542152361,0.019834218638785872,COMPLETE
62,0.6030686451996119,2026-05-03 00:01:22.995404,2026-05-03 00:03:36.895894,0 days 00:02:13.900490,32,True,48,0.21242474173253312,,4,256,0.056497959012033944,0.0008951582169902562,ce,0.7798320830672757,0.21130166964172004,0.17767136779172077,0.12528854245723492,1,1,1,warmup_cosine,1.1,0.9,0.0802509760904803,16,2,0.00013555273508297774,"[0.6233991599791202, 0.5962918069397759]","[1.1254822536052274, 1.1584087347241043]",0.609845483459448,0.6030686451996119,0.013553676519672153,COMPLETE
63,0.6015901108823287,2026-05-03 00:03:37.010318,2026-05-03 00:05:51.279676,0 days 00:02:14.269358,32,True,48,0.2225969166284977,,4,256,0.06538482881200097,0.0007584044991033434,ce,0.5699437229054464,0.2204915686882058,0.19099898186442235,0.16456848565033905,1,1,1,warmup_cosine,1.1,0.9,0.09651237382703724,16,2,0.0003589427516878658,"[0.602431958564208, 0.601309494988369]","[1.1825685399613506, 1.1817431216903156]",0.6018707267762885,0.6015901108823287,0.0005612317879194473,COMPLETE
64,0.6186119385059807,2026-05-03 00:05:51.400470,2026-05-03 00:08:04.819699,0 days 00:02:13.419229,32,True,48,0.20599055904251098,,4,256,0.06249069957957078,0.0007143623532648771,ce,0.6997666793718198,0.23626169071926176,0.17066492810453038,0.2603382482780079,1,1,1,warmup_cosine,1.1,0.9,0.08802086311012258,20,2,0.00010265878553890972,"[0.6168796839614389, 0.6238087021396066]","[1.1839908624438644, 1.1546534742954537]",0.6203441930505227,0.6186119385059807,0.003464509089083856,COMPLETE
65,0.46355392600325157,2026-05-03 00:08:04.928544,2026-05-03 00:08:34.253500,0 days 00:00:29.324956,32,True,48,0.24795207006752176,,6,256,0.06264111265141128,0.0002122501197186127,ce,0.7071325891284812,0.2364365819937816,0.15135851539400788,0.26061001536279294,1,1,1,warmup_cosine,1.1,0.9,0.08800649656264319,20,2,0.00010244993504138676,,,,,,PRUNED
66,0.6143878662307589,2026-05-03 00:08:34.367850,2026-05-03 00:10:47.665147,0 days 00:02:13.297297,32,True,48,0.20794164414124094,,4,256,0.02026767707854972,0.0007109330093322327,ce,0.9685063212443097,0.21256565146549264,0.10383597085404589,0.24019814583237079,1,1,1,warmup_cosine,1.1,0.9,0.11683394437625888,16,3,7.817955644110628e-05,"[0.6133834890340452, 0.6174009978209005]","[1.0829098013093432, 1.1015004467049376]",0.6153922434274728,0.6143878662307589,0.002008754393427681,COMPLETE
67,0.49536114652406427,2026-05-03 00:10:47.784786,2026-05-03 00:11:16.986827,0 days 00:00:29.202041,32,True,48,0.20917263907684133,,4,256,0.025507646765858226,0.0004836742723974843,ce,0.9319617663184352,0.20195091132281273,0.11801745340192187,0.24517998994239038,1,1,1,warmup_cosine,1.1,0.9,0.1213968697107173,16,3,4.5480685985040925e-05,,,,,,PRUNED
68,0.5290817482600063,2026-05-03 00:11:17.099966,2026-05-03 00:11:54.672376,0 days 00:00:37.572410,32,True,48,0.21878236571103046,,6,256,0.07126465121603644,0.0007214125401550089,ce,0.8606227282839161,0.21252124000058,0.21399409234115327,0.2059948227754613,1,1,1,warmup_cosine,1.1,0.9,0.10493178148772381,16,4,8.38631884222711e-05,,,,,,PRUNED
69,0.5041771822100333,2026-05-03 00:11:54.787153,2026-05-03 00:12:24.039451,0 days 00:00:29.252298,32,True,48,0.23185706150755794,,4,256,0.0373321618219444,0.0006224835189945772,ce,0.7767853198075932,0.2417303762167523,0.10052425785573425,0.17570034512814312,1,1,1,warmup_cosine,1.1,0.9,0.0755598699717456,16,3,7.157540637243683e-05,,,,,,PRUNED
