number,value,datetime_start,datetime_complete,duration,params_batch_size,params_class_weighting,params_cnn_channels,params_dropout,params_focal_gamma,params_freq_mask_param,params_hidden_size,params_label_smoothing,params_learning_rate,params_loss_type,params_max_grad_norm,params_min_lr_ratio,params_mixup_alpha,params_mixup_prob,params_num_freq_masks,params_num_layers,params_num_time_masks,params_scheduler_type,params_speed_perturb_max,params_speed_perturb_min,params_speed_perturb_prob,params_time_mask_param,params_warmup_epochs,params_weight_decay,user_attrs_repeat_best_f1s,user_attrs_repeat_best_losses,user_attrs_repeat_mean_f1,user_attrs_repeat_robust_score,user_attrs_repeat_std_f1,state
0,0.5101240254279464,2026-05-02 20:16:48.767123,2026-05-02 20:19:42.930171,0 days 00:02:54.163048,32,True,80,0.50024611871736,1.5047566751329413,12,192,0.12010580865919948,0.00018953847119167273,focal,1.2024056091116424,0.2968832277149541,0.14931495181054177,0.4664125546929756,4,3,2,plateau,1.1,0.9,0.2838430600450275,28,6,0.0002680625716168528,"[0.5081057427722319, 0.5161788733950898]","[0.8885338946783857, 0.905829666615676]",0.5121423080836609,0.5101240254279464,0.004036565311428986,COMPLETE
1,0.5482009903104033,2026-05-02 20:19:43.048523,2026-05-02 20:22:23.046877,0 days 00:02:39.998354,32,False,48,0.5005124225754032,,14,320,0.0882129075234533,0.0008995413762982352,ce,0.6171549786784932,0.12793616899861893,0.4751480754241686,0.48363479504504536,4,2,4,warmup_cosine,1.1,0.9,0.05737265546104689,32,2,0.0013656680018739296,"[0.564962487051222, 0.5426138247301304]","[1.2952099709773808, 1.3159270180786828]",0.5537881558906762,0.5482009903104033,0.01117433116054578,COMPLETE
2,0.36831691005848954,2026-05-02 20:22:23.161118,2026-05-02 20:24:30.329605,0 days 00:02:07.168487,64,True,48,0.4958411143400584,,8,256,0.04970606684977592,0.00013948250171100964,ce,0.7177452757007576,0.139775406453303,0.15425520852856117,0.13911520443426634,2,3,4,warmup_cosine,1.1,0.9,0.04550541126338433,32,3,0.00016338165448210665,"[0.36416221610526095, 0.3807809919181755]","[1.5270804632767785, 1.4970077859411994]",0.3724716040117182,0.36831691005848954,0.008309387906457272,COMPLETE
3,0.39474259826895275,2026-05-02 20:24:30.445604,2026-05-02 20:26:59.223510,0 days 00:02:28.777906,32,False,80,0.5391130091493515,2.7713715163347525,16,320,0.053150630881519466,0.00013368287393030409,focal,0.6846847033513755,0.28934821901821184,0.13461345484827703,0.3406946419769482,2,3,3,plateau,1.1,0.9,0.17877468717318226,28,3,7.938088234380311e-05,"[0.48586049030950584, 0.3643699675887684]","[0.6696908006565176, 0.8112022658046201]",0.4251152289491371,0.39474259826895275,0.06074526136036873,COMPLETE
4,0.3992923442198437,2026-05-02 20:26:59.340454,2026-05-02 20:29:04.826330,0 days 00:02:05.485876,64,False,64,0.5316907762409392,,8,320,0.047273321188258235,0.00018576368287677943,ce,1.3858970960398274,0.20224860744369533,0.118659611652358,0.17106713189057315,3,2,4,warmup_cosine,1.1,0.9,0.24018660722278823,32,2,0.0006060346967779147,"[0.39455268653671677, 0.4135113172692246]","[1.4800380868591565, 1.4446586076018335]",0.40403200190297067,0.3992923442198437,0.009479315366253904,COMPLETE
5,0.5744942974979239,2026-05-02 20:29:04.945210,2026-05-02 20:31:11.206282,0 days 00:02:06.261072,64,False,64,0.3382664940803157,1.80801454334177,12,320,0.07898750418482299,0.0009154690949617708,focal,1.4222658194834816,0.0786489121425709,0.22443521936293342,0.46369400386746706,2,2,4,plateau,1.1,0.9,0.2981328231697334,28,7,0.00027238455541257376,"[0.5727637363025441, 0.5796859810840637]","[0.6956455721843728, 0.7103047087895784]",0.5762248586933039,0.5744942974979239,0.0034611223907597966,COMPLETE
6,0.3010793255930454,2026-05-02 20:31:11.320032,2026-05-02 20:31:42.497914,0 days 00:00:31.177882,32,False,80,0.5400806969289712,,12,320,0.13912512786241812,0.00024343784761690117,ce,1.1142432060730796,0.2594324031744069,0.46842363764653483,0.13980643994046635,4,1,2,warmup_cosine,1.1,0.9,0.21813475043169883,48,6,0.0006398720238157944,,,,,,PRUNED
7,0.5788424095706102,2026-05-02 20:31:42.605347,2026-05-02 20:34:04.298394,0 days 00:02:21.693047,64,False,80,0.37535301608113236,2.413174361259864,12,320,0.13665479730757663,0.0007371703799011769,focal,1.5162172802913956,0.15811412961245624,0.1870044923039006,0.14409959910656656,4,3,2,warmup_invsqrt,1.1,0.9,0.2862579690289526,36,2,0.0001948315124173845,"[0.5873952520989548, 0.5759914620611619]","[0.635007321977501, 0.6419605452308266]",0.5816933570800584,0.5788424095706102,0.0057018950188964515,COMPLETE
8,0.5735472026541737,2026-05-02 20:34:04.419988,2026-05-02 20:36:21.905958,0 days 00:02:17.485970,64,True,64,0.3547744082805947,,8,256,0.11394931414359055,0.0005019134544935481,ce,1.781710541156672,0.2895797419480447,0.17793327036034126,0.37181617410015944,2,3,4,plateau,1.1,0.9,0.0780943327135905,24,4,0.0002984086431609247,"[0.5719380413203563, 0.5783746866556256]","[1.301971764587384, 1.2862079695260211]",0.575156363987991,0.5735472026541737,0.0032183226676346655,COMPLETE
9,0.18842456770641283,2026-05-02 20:36:22.016616,2026-05-02 20:36:47.339539,0 days 00:00:25.322923,64,True,64,0.5309166904918565,1.903102644041797,6,256,0.1350291116388467,0.0001610148991787925,focal,1.7828597886116704,0.27594146521749313,0.1389449608918472,0.3155399234101546,2,1,4,warmup_invsqrt,1.1,0.9,0.2029447818903092,44,5,0.00020295513750923804,,,,,,PRUNED
10,0.3746870380300954,2026-05-02 20:36:47.453751,2026-05-02 20:37:16.209641,0 days 00:00:28.755890,64,False,80,0.41528894476459255,2.6020257243892093,16,192,0.10731939417388504,0.0004566769801355644,focal,1.9975292476955948,0.20264751761441252,0.3096794157584128,0.2341965636261672,3,3,3,warmup_invsqrt,1.1,0.9,0.1300134073124224,40,8,7.381686895834254e-05,,,,,,PRUNED
11,0.5594398524727288,2026-05-02 20:37:16.324057,2026-05-02 20:38:19.504983,0 days 00:01:03.180926,64,False,64,0.3045654087251752,2.205799143056386,10,320,0.07352229313464913,0.0009594740930315511,focal,1.48191914560492,0.062297458160299204,0.261915005080915,0.23524557460625856,3,2,2,warmup_invsqrt,1.1,0.9,0.29526837736068956,40,8,0.00012779084294020616,,,,,,PRUNED
12,0.5604467444501551,2026-05-02 20:38:19.616668,2026-05-02 20:40:29.869399,0 days 00:02:10.252731,64,False,80,0.37772753945065124,2.2514347202669955,14,320,0.07808805281838008,0.0006157884932508801,focal,1.5312423111834372,0.05218949392562812,0.24469898295902348,0.3881051231324414,3,2,3,warmup_invsqrt,1.1,0.9,0.2570245167277245,20,7,0.00045601707969541755,"[0.5782802189080294, 0.554502252964197]","[0.6274247975658169, 0.659154269478018]",0.5663912359361132,0.5604467444501551,0.011888982971916207,COMPLETE
13,0.5916195072461555,2026-05-02 20:40:29.985386,2026-05-02 20:42:37.202287,0 days 00:02:07.216901,64,False,64,0.3090437619344268,1.8540560958405834,10,320,0.09709142536659476,0.0007008404089710425,focal,1.0568732391327098,0.10231924182297142,0.3465603673525166,0.4192122493999691,4,2,3,plateau,1.1,0.9,0.12914346454688885,36,5,0.00011730136316101333,"[0.5997598672962217, 0.5889060538961335]","[0.6681669811836536, 0.6939343352683728]",0.5943329605961776,0.5916195072461555,0.005426906700044087,COMPLETE
14,0.5523257703435674,2026-05-02 20:42:37.319899,2026-05-02 20:43:31.131266,0 days 00:00:53.811367,64,False,48,0.23755841148010903,2.3623163871560084,4,320,0.03175449449486246,0.00035783072526787235,focal,1.1414760263253527,0.11328973793761367,0.35290269894464515,0.2551357449566356,1,1,1,plateau,1.1,0.9,0.12659853994381043,36,4,2.7337759499800277e-05,,,,,,PRUNED
15,0.43419182486920005,2026-05-02 20:43:31.248120,2026-05-02 20:44:04.091398,0 days 00:00:32.843278,64,False,64,0.40677101739091676,1.9442626788102584,10,192,0.0997431665092826,0.0006290881195492078,focal,0.9088584718248158,0.16748100630294546,0.387175124831873,0.10486875930559489,4,3,2,warmup_invsqrt,1.1,0.9,0.09796384178400681,40,4,0.00010174968713281372,,,,,,PRUNED
16,0.5893992124827334,2026-05-02 20:44:04.214194,2026-05-02 20:46:18.733250,0 days 00:02:14.519056,64,False,80,0.30072037984035893,2.973198027203861,10,320,0.12729325584748866,0.0007297938395242496,focal,0.98405285049067,0.09288972069965469,0.3968391148767933,0.41226695599780405,4,2,3,warmup_invsqrt,1.1,0.9,0.014308001701789808,36,5,6.214661249825216e-05,"[0.5985783217418413, 0.5863395093963641]","[0.5148380689269347, 0.5435650971153085]",0.5924589155691027,0.5893992124827334,0.006119406172738595,COMPLETE
17,0.5723060419974317,2026-05-02 20:46:18.851896,2026-05-02 20:48:30.486588,0 days 00:02:11.634692,64,False,80,0.3005565813026899,2.814033581880829,10,320,0.1228755562366156,0.0003572337936660873,focal,0.869241830743876,0.09819326774460582,0.4129856324773465,0.42387347306216855,4,2,3,plateau,1.1,0.9,0.0010233628951876565,48,5,5.502303354620259e-05,"[0.592021712597192, 0.5657341517975115]","[0.5587595122680962, 0.5539852031272092]",0.5788779321973518,0.5723060419974317,0.013143780399840266,COMPLETE
18,0.3074865341080012,2026-05-02 20:48:30.601717,2026-05-02 20:49:06.819006,0 days 00:00:36.217289,32,True,64,0.4522999382512261,2.9904610807524192,10,256,0.09732420769668748,0.00010215264282311944,focal,0.9215490652852294,0.09294581779699505,0.31543648130890173,0.42946965600550496,4,2,3,warmup_invsqrt,1.1,0.9,0.004468215800920116,44,6,6.279396222538965e-05,,,,,,PRUNED
19,0.5627964837574854,2026-05-02 20:49:06.931950,2026-05-02 20:50:05.507372,0 days 00:00:58.575422,64,False,48,0.2550716530500541,1.6246561002469404,6,192,0.06652451188311621,0.0004714210589285532,focal,1.0284754753112377,0.19814126924970127,0.42678289567976396,0.4004714284524553,1,2,1,plateau,1.1,0.9,0.15687862537933195,16,5,1.1762773748658173e-05,,,,,,PRUNED
20,0.4576228688701599,2026-05-02 20:50:05.635794,2026-05-02 20:50:38.215114,0 days 00:00:32.579320,64,False,80,0.3238017205490714,2.1674134465037858,14,320,0.12139287476773251,0.0002997814962434586,focal,0.5173561751451484,0.233738202507015,0.3532290804276375,0.35150024933721036,3,2,3,warmup_invsqrt,1.1,0.9,0.03414946598447957,36,5,0.00012136534497241054,,,,,,PRUNED
21,,2026-05-02 20:50:38.330629,2026-05-02 20:52:49.302320,0 days 00:02:10.971691,64,False,80,0.376891240018339,2.6013607859297547,12,320,0.13354046303678743,0.0007243968795393411,focal,1.3279145123396383,0.15968761553236874,0.3442787717234931,0.2742448402295787,4,2,3,warmup_invsqrt,1.1,0.9,0.1744296151689103,36,3,0.00016140854847469636,,,,,,FAIL
22,0.5228563145397647,2026-05-02 20:53:33.488699,2026-05-02 20:54:38.292400,0 days 00:01:04.803701,64,False,80,0.36973871103586853,2.532117277909103,12,320,0.12972141189228256,0.0007023448165640189,focal,1.2805398380096678,0.15660175266008863,0.20412011237069888,0.28671780311374034,4,2,3,warmup_invsqrt,1.1,0.9,0.092830009057456,36,3,0.00016277565516398094,,,,,,PRUNED
23,0.42557531524184833,2026-05-02 20:54:38.445628,2026-05-02 20:55:22.066167,0 days 00:00:43.620539,64,False,80,0.329085938235691,2.9879671663681835,10,320,0.13001066950385462,0.0007456938797360972,focal,1.6296420582039983,0.1376403944990358,0.2791238142562308,0.19372656670366548,4,3,3,warmup_invsqrt,1.1,0.9,0.1845515820264007,36,4,9.175813003704366e-05,,,,,,PRUNED
24,0.5286463134459225,2026-05-02 20:55:22.213819,2026-05-02 20:56:19.203240,0 days 00:00:56.989421,64,False,80,0.3838606689679973,2.039409453557739,12,320,0.11025874868143633,0.0007925308588882006,focal,1.3252737523388038,0.11127448390964595,0.3560440305001656,0.43564487396538654,4,1,2,warmup_invsqrt,1.1,0.9,0.11902831912198795,40,2,0.00018134331500232944,,,,,,PRUNED
25,0.3970107754935997,2026-05-02 20:56:19.346677,2026-05-02 20:56:54.826740,0 days 00:00:35.480063,64,False,80,0.44399270890885456,2.4849918952338936,8,320,0.09034577339497993,0.0005432883214443546,focal,1.0347194004562617,0.07785707654274496,0.4344054465586481,0.2927169728230077,4,2,3,warmup_invsqrt,1.1,0.9,0.1646951578526358,44,7,5.155903216005637e-05,,,,,,PRUNED
26,0.422621717723356,2026-05-02 20:56:54.980167,2026-05-02 20:57:39.124790,0 days 00:00:44.144623,64,False,64,0.35741381568415626,1.7283536791258138,14,320,0.13979986644570602,0.00042613942433609005,focal,0.8034934742451317,0.17896264971948908,0.38654041362656216,0.32217689156096196,4,3,2,plateau,1.1,0.9,0.2614178566485186,32,6,0.00012095347857004761,,,,,,PRUNED
27,0.6017042145547844,2026-05-02 20:57:39.266612,2026-05-02 21:01:21.393760,0 days 00:03:42.127148,32,True,80,0.31362897224931313,,10,320,0.13037086725585156,0.0005968436639679396,ce,1.6152230972573984,0.11835446027546742,0.29271180490816323,0.36288557900432344,4,2,2,warmup_invsqrt,1.1,0.9,0.02647621525252908,36,3,0.0004444538955277559,"[0.6000949348064669, 0.6065320537997366]","[1.2691779531163276, 1.260016441916962]",0.6033134943031018,0.6017042145547844,0.003218559496634854,COMPLETE
28,0.6000730268594694,2026-05-02 21:01:21.552179,2026-05-02 21:04:58.733883,0 days 00:03:37.181704,32,True,80,0.3122748616699908,,10,320,0.1023218815310569,0.0005951141875319491,ce,1.0168002276524672,0.11982150002649236,0.3299045793240836,0.40126640812243003,3,2,3,warmup_invsqrt,1.1,0.9,0.023161697878769306,40,3,0.0011083095668385245,"[0.597697155355083, 0.6072006413726284]","[1.2442083270143833, 1.2323657380019446]",0.6024488983638557,0.6000730268594694,0.00475174300877268,COMPLETE
29,0.47816687948788456,2026-05-02 21:04:58.882524,2026-05-02 21:05:50.693640,0 days 00:00:51.811116,32,True,48,0.34284107616151954,,8,256,0.09900727686746603,0.0005784622688654225,ce,1.6897659158735885,0.12225452864960065,0.32019531368088117,0.3731985291844431,3,2,3,warmup_cosine,1.1,0.9,0.0693042027409487,40,3,0.001780413746338579,,,,,,PRUNED
30,0.546394233254435,2026-05-02 21:05:50.842041,2026-05-02 21:07:04.071202,0 days 00:01:13.229161,32,True,64,0.31667393362362867,,10,192,0.10573944034586724,0.00026242121182941245,ce,1.2401349434703535,0.07130505773353656,0.28439535471122496,0.45934688931548,3,2,2,plateau,1.1,0.9,0.03360247625829587,44,3,0.0012082160137995264,,,,,,PRUNED
31,0.5752140379934445,2026-05-02 21:07:04.217309,2026-05-02 21:10:25.203798,0 days 00:03:20.986489,32,True,80,0.35495290886316455,,8,192,0.11698354897731114,0.00039134976466705584,ce,1.163982840283754,0.14322440100327555,0.3293455244559434,0.4985920697682191,3,2,2,plateau,1.1,0.9,0.10331832022961812,28,4,0.0004075149597767396,"[0.5924268685270889, 0.5694764278155631]","[1.2725748335428946, 1.301561652327613]",0.5809516481713259,0.5752140379934445,0.011475220355762927,COMPLETE
32,0.546832420484953,2026-05-02 21:10:25.353196,2026-05-02 21:11:46.627364,0 days 00:01:21.274168,32,True,80,0.31207970262589096,,10,320,0.1272346809836031,0.0006362991798938238,ce,0.9738480265773346,0.09588603832845094,0.3755100075838393,0.4099564041690074,4,2,3,warmup_invsqrt,1.1,0.9,0.01778958555892756,36,5,0.0009339061346534102,,,,,,PRUNED
33,0.5478931188412636,2026-05-02 21:11:46.774289,2026-05-02 21:13:04.534202,0 days 00:01:17.759913,32,True,80,0.33225206020251485,,10,320,0.08975488713123679,0.0008281567233802892,ce,1.0739002211585522,0.10997713107990197,0.2912555271552346,0.44353656398790775,4,2,3,warmup_invsqrt,1.1,0.9,0.05673659870007035,32,6,0.0006886453409613329,,,,,,PRUNED
34,0.6035798533188129,2026-05-02 21:13:04.663409,2026-05-02 21:16:13.983357,0 days 00:03:09.319948,32,True,80,0.31251157581194383,,10,320,0.11410294998745787,0.0006808690100232886,ce,0.809814487917578,0.12817294017949588,0.3355196504825353,0.34819462946643215,3,2,3,warmup_invsqrt,1.1,0.9,0.024245310173068566,40,3,0.00039126190175061787,"[0.6006748869306685, 0.6122947524832462]","[1.2507396071648997, 1.2394688289514262]",0.6064848197069573,0.6035798533188129,0.005809932776288829,COMPLETE
35,0.45833370474921903,2026-05-02 21:16:14.121857,2026-05-02 21:16:55.776741,0 days 00:00:41.654884,32,True,80,0.3981273722064094,,12,320,0.10447704492553755,0.0005167048825862108,ce,0.745516361796269,0.12788281831523848,0.3411841577407449,0.34589164092711205,3,2,4,warmup_invsqrt,1.1,0.9,0.03635644052908062,40,3,0.00037261037322139254,,,,,,PRUNED
36,0.5985497409573836,2026-05-02 21:16:55.916949,2026-05-02 21:19:59.695631,0 days 00:03:03.778682,32,True,48,0.3203237350388653,,8,320,0.11322858596491205,0.0008753433546013588,ce,0.6443220931265325,0.1476302959140851,0.24545941421029843,0.3719301026803966,3,2,3,warmup_cosine,1.1,0.9,0.05152569867348972,44,2,0.0008337392938940058,"[0.6216928369439494, 0.5908353756285283]","[1.2332619984658788, 1.2700267615649912]",0.6062641062862388,0.5985497409573836,0.015428730657710554,COMPLETE
37,0.5907906294556297,2026-05-02 21:19:59.823802,2026-05-02 21:23:02.668963,0 days 00:03:02.845161,32,True,48,0.3421328357623148,,6,320,0.11702356810072112,0.0008327856712225405,ce,0.6235549038730575,0.18562688666091948,0.2456210352507611,0.3659822229985077,3,2,4,warmup_cosine,1.1,0.9,0.054636752373289924,44,2,0.000882948395821974,"[0.5891098651080933, 0.5958329224982389]","[1.2615028216684465, 1.2717543693183424]",0.592471393803166,0.5907906294556297,0.003361528695072835,COMPLETE
38,0.6053166340092406,2026-05-02 21:23:02.804993,2026-05-02 21:26:06.592563,0 days 00:03:03.787570,32,True,48,0.32350767213360787,,8,320,0.11294289089970792,0.0009748828443014544,ce,0.52473636370476,0.14596580832683487,0.22373776543804774,0.3280140564800826,3,2,3,warmup_cosine,1.1,0.9,0.024706156874399438,48,2,0.0005148524444116375,"[0.608422618746185, 0.6042813057635925]","[1.2448731603668177, 1.2601227904681107]",0.6063519622548887,0.6053166340092406,0.00207065649129623,COMPLETE
39,0.599140281492274,2026-05-02 21:26:06.727472,2026-05-02 21:28:43.967594,0 days 00:02:37.240122,32,True,48,0.28197355615241204,,8,320,0.09285469900557039,0.0009359469196079643,ce,0.5456060824471931,0.130710178280229,0.2180132644933011,0.32442480331355283,2,1,1,warmup_cosine,1.1,0.9,0.023256048615072578,24,2,0.0005119773117824232,"[0.6138291587598382, 0.5942439890697526]","[1.2467545130841737, 1.2361852333700056]",0.6040365739147955,0.599140281492274,0.009792584845042807,COMPLETE
40,0.42898708192660007,2026-05-02 21:28:44.101152,2026-05-02 21:29:24.580699,0 days 00:00:40.479547,32,True,48,0.4720635514627134,,12,256,0.12322192257624495,0.0005571180853670951,ce,0.7649754686973194,0.15351839220256241,0.2729348567053034,0.2738060960638192,3,2,3,warmup_cosine,1.1,0.9,0.06763557662401672,48,3,0.00023753631399873817,,,,,,PRUNED
41,0.5952049931594809,2026-05-02 21:29:24.708345,2026-05-02 21:32:27.465288,0 days 00:03:02.756943,32,True,48,0.34687994631479496,,8,320,0.11063221688563468,0.000660946947487677,ce,0.8224723048784707,0.16456575217716046,0.49591291906512874,0.31144493286776365,3,2,4,warmup_cosine,1.1,0.9,0.0831396041994188,48,3,0.0005519584123473343,"[0.5968998460851432, 0.5946400421842601]","[1.2611198478179584, 1.271682608613579]",0.5957699441347017,0.5952049931594809,0.0011299019504415475,COMPLETE
42,0.6084814867603048,2026-05-02 21:32:27.600300,2026-05-02 21:35:04.702307,0 days 00:02:37.102007,32,True,48,0.281377603695044,,6,320,0.09380867325921055,0.0009512463887207711,ce,0.5183947620490327,0.13146229891967576,0.16511971626375238,0.3342026706702706,2,1,1,warmup_cosine,1.1,0.9,0.025063762217918173,24,2,0.000316600350477019,"[0.6068528825612431, 0.6133672993574896]","[1.2210354776405317, 1.2400654434300156]",0.6101100909593664,0.6084814867603048,0.0032572083981232125,COMPLETE
43,0.6087878833369706,2026-05-02 21:35:04.841331,2026-05-02 21:37:41.122288,0 days 00:02:36.280957,32,True,48,0.28334374468909124,,4,320,0.08480012131343516,0.0009788441243745603,ce,0.5570799790429182,0.11969122497891235,0.17857453305955237,0.33863716810700434,2,1,1,warmup_cosine,1.1,0.9,0.023257805488874534,24,2,0.00032220789659876526,"[0.6082461916958689, 0.6104129582602762]","[1.2080150591097862, 1.2247512006073547]",0.6093295749780725,0.6087878833369706,0.0010833832822036427,COMPLETE
44,0.6036878020856786,2026-05-02 21:37:41.256204,2026-05-02 21:40:18.200053,0 days 00:02:36.943849,32,True,48,0.27749528141574276,,4,320,0.08477241099767559,0.000988832412672365,ce,0.6011675449264016,0.1326003709237394,0.15779267890585155,0.334685290370876,2,1,1,warmup_cosine,1.1,0.9,0.0415505841736352,24,2,0.00032684937576914794,"[0.5991393484574082, 0.61733316297049]","[1.215625554251728, 1.1935318585494155]",0.6082362557139491,0.6036878020856786,0.009096907256540887,COMPLETE
45,0.6001740901059243,2026-05-02 21:40:18.334783,2026-05-02 21:42:55.473817,0 days 00:02:37.139034,32,True,48,0.28131669467811243,,4,320,0.08439047097640491,0.0009848006917386328,ce,0.5675507367383884,0.13620817550009076,0.10968981526125318,0.33483051131279007,2,1,1,warmup_cosine,1.1,0.9,0.04433528172290763,24,2,0.00031674750377986893,"[0.5988903296538921, 0.6040253714620207]","[1.21336968225255, 1.2209945548352579]",0.6014578505579564,0.6001740901059243,0.002567520904064313,COMPLETE
46,0.586600050076686,2026-05-02 23:35:15.145320,2026-05-02 23:36:59.964123,0 days 00:01:44.818803,32,True,48,0.28320967419551346,,4,320,0.08397271570936433,0.0009804186784996027,ce,0.6702118565375045,0.14249316942910442,0.16190656951382562,0.30142838468957506,2,1,1,warmup_cosine,1.1,0.9,0.0005793615190112789,20,2,0.0003234381329839157,,,,,,PRUNED
47,0.5864415537959431,2026-05-02 23:37:00.089091,2026-05-02 23:38:07.094127,0 days 00:01:07.005036,32,True,48,0.2634768062627335,,6,320,0.07450568160523183,0.0008628653727689955,ce,0.504385317653848,0.17438979907901425,0.12902733538197467,0.33592136551112217,2,1,1,warmup_cosine,1.1,0.9,0.04053855602640579,28,2,0.00023134803694941093,,,,,,PRUNED
