number,value,datetime_start,datetime_complete,duration,params_batch_size,params_class_weighting,params_cnn_channels,params_dropout,params_focal_gamma,params_freq_mask_param,params_hidden_size,params_label_smoothing,params_learning_rate,params_loss_type,params_max_grad_norm,params_min_lr_ratio,params_mixup_alpha,params_mixup_prob,params_num_freq_masks,params_num_layers,params_num_time_masks,params_scheduler_type,params_speed_perturb_max,params_speed_perturb_min,params_speed_perturb_prob,params_time_mask_param,params_warmup_epochs,params_weight_decay,user_attrs_repeat_best_f1s,user_attrs_repeat_best_losses,user_attrs_repeat_mean_f1,user_attrs_repeat_robust_score,user_attrs_repeat_std_f1,state
287,0.6067146247734017,2026-05-03 10:52:28.186142,2026-05-03 10:53:40.908999,0 days 00:01:12.722857,32,True,80,0.22184586364919973,,10,192,0.028548442428294685,0.0007544671608427153,ce,1.6818261752125627,0.17674080715450993,0.4769144506351411,0.2035263035730688,2,1,1,plateau,1.1,0.9,0.1603115622724325,32,3,1.8430771957922025e-05,,,,,,PRUNED
288,0.6365200168403115,2026-05-03 10:53:41.010902,2026-05-03 10:55:32.456880,0 days 00:01:51.445978,32,True,80,0.2082572847018392,,10,192,0.027016221991302807,0.0006957997319398757,ce,1.7419951636584197,0.18040089804925516,0.4188716036579934,0.17952630380302684,2,1,1,plateau,1.1,0.9,0.16501756104973314,24,3,1.4302549880690821e-05,,,,,,PRUNED
289,0.5264947714108427,2026-05-03 10:55:32.558169,2026-05-03 10:56:07.205837,0 days 00:00:34.647668,32,True,80,0.21518592516733934,,10,192,0.025878489558800292,0.0007368484866889219,ce,1.6586344293296025,0.17263611587991276,0.49244454722574804,0.18348554790338797,2,1,1,plateau,1.1,0.9,0.1467314467956405,24,3,1.5681971841387365e-05,,,,,,PRUNED
290,0.5124033430948838,2026-05-03 10:56:07.317034,2026-05-03 10:56:34.277683,0 days 00:00:26.960649,32,True,80,0.2293838114188859,,10,192,0.028179457063375057,0.0007880854590362223,ce,1.7205579757157083,0.18864358857052976,0.4646881890881979,0.18993743397038806,2,1,1,plateau,1.1,0.9,0.17193062449737576,24,3,1.6368486549042375e-05,,,,,,PRUNED
291,0.5351312253620262,2026-05-03 10:56:34.390899,2026-05-03 10:57:16.513292,0 days 00:00:42.122393,32,True,80,0.20510198574227725,,10,192,0.023456592115495074,0.0006610615200122021,ce,1.6460184051058606,0.18248729266789715,0.16492765792589406,0.1382985530009812,2,1,1,plateau,1.1,0.9,0.18674129087199348,24,3,1.2649843386160196e-05,,,,,,PRUNED
292,0.5525982337126893,2026-05-03 10:57:16.614465,2026-05-03 10:58:06.776492,0 days 00:00:50.162027,32,True,80,0.21158286654575678,,10,192,0.029389750512692117,0.000729869035084626,ce,1.6885454377380649,0.17109876933699017,0.14545992821489098,0.18200768608187803,1,1,1,plateau,1.1,0.9,0.15579216201729065,24,3,1.7490228460163633e-05,,,,,,PRUNED
293,0.4692386215031983,2026-05-03 10:58:06.881570,2026-05-03 10:58:33.652684,0 days 00:00:26.771114,32,True,80,0.27569364528506607,,10,192,0.025641035030071677,0.0007751817058063909,ce,1.755420591227878,0.17648866701739646,0.4266763862610294,0.1668809499047155,2,1,1,plateau,1.1,0.9,0.14968571947916762,24,3,1.9143505776952142e-05,,,,,,PRUNED
294,0.6190015043318747,2026-05-03 10:58:33.751572,2026-05-03 10:59:53.993059,0 days 00:01:20.241487,32,True,80,0.20494690200250923,,10,192,0.02723686223500145,0.0006989776868103923,ce,1.712618176591866,0.19209777178297005,0.44989816683114014,0.16749959892313396,2,1,1,plateau,1.1,0.9,0.1431795663812151,24,3,2.3611162751329098e-05,,,,,,PRUNED
295,0.544739501770192,2026-05-03 10:59:54.102865,2026-05-03 11:00:32.367374,0 days 00:00:38.264509,32,True,80,0.2180951832145811,,4,192,0.02180750682713965,0.0008095228413557882,ce,1.634654028728767,0.1681001514651165,0.17873515020563388,0.1766964170206044,2,1,1,plateau,1.1,0.9,0.16352520315554298,24,3,2.809640547264983e-05,,,,,,PRUNED
296,0.49606631021232495,2026-05-03 11:00:32.472405,2026-05-03 11:01:08.529360,0 days 00:00:36.056955,32,True,80,0.30064635955427915,,14,320,0.04120553808211897,0.0007345916405877008,ce,0.5814222345022176,0.24759523533155953,0.45846931689158515,0.16075387797778923,2,1,2,plateau,1.1,0.9,0.15606556127913201,24,3,5.0938809683190245e-05,,,,,,PRUNED
297,0.5495117713475062,2026-05-03 11:01:08.641065,2026-05-03 11:01:54.619490,0 days 00:00:45.978425,32,True,80,0.21167872888050285,,10,192,0.024557894298895606,0.0007666179184976509,ce,1.1861557024112532,0.18402136286972623,0.14536860006564842,0.1944731253384185,1,1,1,plateau,1.1,0.9,0.20236639274595208,24,3,0.0003446153096924927,,,,,,PRUNED
298,0.5875588818923053,2026-05-03 11:01:54.719414,2026-05-03 11:02:51.887558,0 days 00:00:57.168144,32,True,80,0.2084281486007108,,10,192,0.030301094180808334,0.0006800522955974791,ce,1.6836313248341022,0.17783589530194904,0.1555328485485635,0.14071479331120218,2,1,1,plateau,1.1,0.9,0.19074728297702692,24,3,2.1540569626101686e-05,,,,,,PRUNED
299,0.5380338203157427,2026-05-03 11:02:51.992623,2026-05-03 11:03:30.551098,0 days 00:00:38.558475,32,True,80,0.22336368971095918,,10,192,0.03203278906628463,0.0008144478028236341,ce,1.294474262017895,0.18712146312935155,0.4110775658339701,0.4633264482918101,2,1,1,plateau,1.1,0.9,0.13949399840519383,24,6,2.9081801675949598e-05,,,,,,PRUNED
300,0.6364231822759268,2026-05-03 11:03:30.655200,2026-05-03 11:05:06.781321,0 days 00:01:36.126121,32,True,80,0.20002657186812972,,10,192,0.028692543886422315,0.000714211528230942,ce,1.7752656140533374,0.1805313240787475,0.17464203373642925,0.15335028123412012,2,1,1,plateau,1.1,0.9,0.16617416184702863,24,7,1.6813286119039207e-05,,,,,,PRUNED
301,0.5054146546047108,2026-05-03 11:05:06.899426,2026-05-03 11:05:35.308135,0 days 00:00:28.408709,32,True,80,0.30059637734133926,,10,256,0.041080819706036026,0.000776004517119884,ce,1.6452048802851529,0.17159236675711925,0.379225042461928,0.4849196497146309,2,1,2,plateau,1.1,0.9,0.17593070295946095,28,3,5.1100533767434076e-05,,,,,,PRUNED
