number,value,datetime_start,datetime_complete,duration,params_batch_size,params_class_weighting,params_cnn_channels,params_dropout,params_focal_gamma,params_freq_mask_param,params_hidden_size,params_label_smoothing,params_learning_rate,params_loss_type,params_max_grad_norm,params_min_lr_ratio,params_mixup_alpha,params_mixup_prob,params_num_freq_masks,params_num_layers,params_num_time_masks,params_scheduler_type,params_speed_perturb_max,params_speed_perturb_min,params_speed_perturb_prob,params_time_mask_param,params_warmup_epochs,params_weight_decay,user_attrs_repeat_best_f1s,user_attrs_repeat_best_losses,user_attrs_repeat_mean_f1,user_attrs_repeat_robust_score,user_attrs_repeat_std_f1,state
229,0.6653097412922656,2026-05-03 09:35:18.384501,2026-05-03 09:38:09.841606,0 days 00:02:51.457105,32,False,80,0.21319563543787604,,10,192,0.03802665949533885,0.0009298126903325323,ce,1.3967762178080392,0.16200953290272224,0.302443046378326,0.28294095098704686,2,1,1,plateau,1.1,0.9,0.23653659217159292,24,2,9.054486729942707e-05,[0.6653097412922656],[1.096434035175424],0.6653097412922656,0.6653097412922656,0.0,COMPLETE
230,0.6526239384233453,2026-05-03 09:38:09.948642,2026-05-03 09:40:29.955889,0 days 00:02:20.007247,32,False,80,0.2122607042131806,,10,192,0.03986588927554957,0.0009427419229204537,ce,1.5029923083452184,0.08655726522645307,0.38697678717791884,0.31022825844436724,2,1,1,plateau,1.1,0.9,0.23729064316709672,24,2,9.462745441386218e-05,[0.6526239384233453],[1.0506239612039616],0.6526239384233453,0.6526239384233453,0.0,COMPLETE
231,0.5370170049063601,2026-05-03 09:40:30.057115,2026-05-03 09:41:05.086528,0 days 00:00:35.029413,32,False,80,0.20804713473763706,,10,192,0.04863304398387844,0.0009087618877842344,ce,1.3858881532430871,0.15954815025632016,0.35356325739965583,0.27952475139762406,2,1,1,plateau,1.1,0.9,0.2454682245809168,24,2,1.0955287343582123e-05,,,,,,PRUNED
232,0.5636002552383851,2026-05-03 09:41:05.199888,2026-05-03 09:41:51.819645,0 days 00:00:46.619757,32,False,80,0.2211025569598165,,10,192,0.03786317969771545,0.0009370992845937774,ce,1.3231655785683962,0.16550999843907682,0.30600164179307604,0.29738449834758746,2,1,1,plateau,1.1,0.9,0.16765174041094155,24,2,8.693005163446656e-05,,,,,,PRUNED
233,0.5531039627312119,2026-05-03 09:41:51.923786,2026-05-03 09:42:38.650490,0 days 00:00:46.726704,32,False,80,0.20509378203379477,,10,192,0.03546750355736477,0.0008428743771998145,ce,1.562666372522418,0.1754726708642976,0.29885717352258184,0.330745380997246,2,1,1,plateau,1.1,0.9,0.23053309950438164,24,2,8.123155389161192e-05,,,,,,PRUNED
234,0.6198340683272362,2026-05-03 09:42:38.753410,2026-05-03 09:44:00.322773,0 days 00:01:21.569363,32,False,80,0.21434670159140334,,10,192,0.037539696098346544,0.000992452599753221,ce,1.4344327729389479,0.28896395696540944,0.31591459064806793,0.3677114777088287,2,1,1,plateau,1.1,0.9,0.10125785719198906,24,2,0.00010459823906326234,,,,,,PRUNED
235,0.6660265130346067,2026-05-03 09:44:00.430028,2026-05-03 09:46:51.040196,0 days 00:02:50.610168,32,True,80,0.20977519700178246,,10,192,0.03386309900174272,0.0009030234866375051,ce,1.6105980041621932,0.16213659073353004,0.32500618914701535,0.43973358266699153,2,1,1,plateau,1.1,0.9,0.12071893357340296,24,2,2.5948259722426962e-05,[0.6660265130346067],[1.0948676539839601],0.6660265130346067,0.6660265130346067,0.0,COMPLETE
236,0.61806296759016,2026-05-03 09:46:51.146569,2026-05-03 09:48:12.987672,0 days 00:01:21.841103,32,True,80,0.20959117868168098,,10,192,0.033012899322899934,0.000885058436813867,ce,1.6354053617812754,0.16424655724653828,0.32596036245422993,0.4337866372448667,2,1,1,plateau,1.1,0.9,0.2390297326286706,24,2,3.135423897404775e-05,,,,,,PRUNED
237,0.49872947894259095,2026-05-03 09:48:13.091433,2026-05-03 09:48:40.174757,0 days 00:00:27.083324,32,True,80,0.20029681751910164,,10,192,0.03394071348545393,0.0009301266039895181,ce,1.600896779502948,0.17133223511550516,0.3128173188633596,0.4456293440294938,2,1,1,plateau,1.1,0.9,0.11345137901373444,24,2,2.775017426629805e-05,,,,,,PRUNED
238,0.4904385865886323,2026-05-03 09:48:40.277223,2026-05-03 09:49:06.246613,0 days 00:00:25.969390,32,True,48,0.2048080118164355,,10,192,0.07321145758142523,0.0008003320335439135,ce,1.5314133935242307,0.1601070010065022,0.3746714081587164,0.3458323928767527,2,1,1,plateau,1.1,0.9,0.11984293142283448,24,2,3.4023644817220977e-05,,,,,,PRUNED
239,0.5262034925546398,2026-05-03 09:49:06.350449,2026-05-03 09:49:41.587438,0 days 00:00:35.236989,32,False,80,0.21269771165545037,2.769368624409832,10,192,0.04339462039096275,0.0008874646873796717,focal,1.2243640850360735,0.15588837272709935,0.33517462314961916,0.42210598296037016,2,1,1,plateau,1.1,0.9,0.10550812384124607,24,2,6.844845529435841e-05,,,,,,PRUNED
240,0.4763398327222043,2026-05-03 09:49:41.690719,2026-05-03 09:50:08.851953,0 days 00:00:27.161234,32,True,80,0.2178722839674709,,10,192,0.040086648538825174,0.000950374961091182,ce,1.4863988857617367,0.16918772126045523,0.3315552085682632,0.3153093638431198,2,1,1,plateau,1.1,0.9,0.25544793125089604,36,2,9.336695885317646e-05,,,,,,PRUNED
241,0.5053872433478935,2026-05-03 09:50:08.954647,2026-05-03 09:50:35.003120,0 days 00:00:26.048473,32,True,48,0.2073150658010177,,10,192,0.03186175835205386,0.0008316390057428101,ce,1.5653119589879518,0.16153241525094528,0.3221613651260468,0.43915347308775093,2,1,1,plateau,1.1,0.9,0.22165458187429968,24,2,3.072403916881237e-05,,,,,,PRUNED
242,0.49956500756611344,2026-05-03 09:50:35.107355,2026-05-03 09:51:06.033065,0 days 00:00:30.925710,32,True,80,0.22434427318762198,,10,192,0.035530225094836505,0.0009172382158441962,ce,1.0835322616539165,0.17497664153712722,0.3019891395808341,0.4658535878549214,2,1,1,plateau,1.1,0.9,0.12032827787651151,24,2,2.616491915831629e-05,,,,,,PRUNED
243,0.5596625865623341,2026-05-03 09:51:06.141945,2026-05-03 09:51:52.327937,0 days 00:00:46.185992,32,True,80,0.20017474542360983,,10,192,0.036962173791673936,0.0009961105046473423,ce,1.612313113468626,0.16567792341427198,0.31189510364114176,0.32551574888342033,2,1,1,plateau,1.1,0.9,0.09585458679884755,24,2,2.7742873664656208e-05,,,,,,PRUNED
244,0.6737654717023126,2026-05-03 09:51:52.428977,2026-05-03 09:55:04.476076,0 days 00:03:12.047099,32,True,80,0.21255399223032692,,6,192,0.03402753587044263,0.0007302402959162389,ce,1.6750695240587365,0.1821624042729579,0.29385485968592556,0.45294428107148604,2,1,1,plateau,1.1,0.9,0.11343700704102212,24,3,2.5059885845703345e-05,[0.6737654717023126],[1.101055454293029],0.6737654717023126,0.6737654717023126,0.0,COMPLETE
245,0.6385158530398959,2026-05-03 09:55:04.580771,2026-05-03 09:56:44.184773,0 days 00:01:39.604002,32,True,80,0.20971270983986282,,10,192,0.034131478470025456,0.0007513150765826178,ce,1.6656403729878515,0.1799421743742494,0.2952613853070585,0.4469419214771262,2,1,1,plateau,1.1,0.9,0.11089954882284331,24,3,2.443749121021956e-05,,,,,,PRUNED
246,0.6711638800769828,2026-05-03 09:56:44.295948,2026-05-03 09:59:17.499019,0 days 00:02:33.203071,32,True,80,0.2134051507605354,,6,192,0.03159297232698072,0.0007164363962775111,ce,1.5833198574275427,0.18129995119631925,0.3233187556691383,0.4601935865798233,2,1,1,plateau,1.1,0.9,0.10640778455880684,24,3,0.00026283764461482206,[0.6711638800769828],[1.0465003397824952],0.6711638800769828,0.6711638800769828,0.0,COMPLETE
247,0.6673979952824624,2026-05-03 09:59:17.608918,2026-05-03 10:02:10.141041,0 days 00:02:52.532123,32,True,80,0.2141361159520838,,6,192,0.032313493843459565,0.0007119781743014917,ce,1.652350655558556,0.18091841791462637,0.30644871762770076,0.46237105118327565,2,1,1,plateau,1.1,0.9,0.09803479901758508,24,3,3.5859664604249926e-05,[0.6673979952824624],[1.0630580744297384],0.6673979952824624,0.6673979952824624,0.0,COMPLETE
248,0.44999645134079086,2026-05-03 10:02:10.243562,2026-05-03 10:02:47.947937,0 days 00:00:37.704375,32,True,80,0.3006118926566833,,6,320,0.04171385208776188,0.0007070693035431924,ce,1.6939112453433836,0.18416186576788673,0.30847742258524735,0.47195689213547304,2,3,2,plateau,1.1,0.9,0.10318881497544657,28,3,5.119441521403638e-05,,,,,,PRUNED
249,0.505748560377732,2026-05-03 10:02:48.050259,2026-05-03 10:03:14.733385,0 days 00:00:26.683126,32,True,80,0.21405796746731437,,6,192,0.032172548390021816,0.0006902734364400201,ce,1.6343978534234154,0.18056039661614867,0.3187341440991187,0.4574808543575456,2,1,1,plateau,1.1,0.9,0.09444003872700792,24,3,3.600638512349685e-05,,,,,,PRUNED
250,0.539345100277283,2026-05-03 10:03:14.855678,2026-05-03 10:03:58.354684,0 days 00:00:43.499006,32,True,48,0.21779904955132678,,6,192,0.0342340118932215,0.0007228711580390449,ce,1.595654518311736,0.17713435320986215,0.2999874826017163,0.46284332806133266,2,1,1,plateau,1.1,0.9,0.17679372792485942,24,3,0.00019410285886766997,,,,,,PRUNED
251,0.5431323708241137,2026-05-03 10:03:58.459106,2026-05-03 10:04:36.923084,0 days 00:00:38.463978,32,True,80,0.21124916544734434,,6,192,0.03098090583512962,0.0007378308381987708,ce,1.540800238035426,0.1859880770622782,0.2855901701754662,0.45381195169346866,2,1,1,plateau,1.1,0.9,0.09813588876418289,24,3,7.897138963546938e-05,,,,,,PRUNED
252,0.4783508584413144,2026-05-03 10:04:37.026070,2026-05-03 10:05:10.550676,0 days 00:00:33.524606,32,False,80,0.3006817509655674,,6,192,0.04150892963309882,0.0006864790389137692,ce,1.662594629079975,0.18746282937526682,0.3056445161128487,0.46810096623428593,4,3,2,plateau,1.1,0.9,0.10846436966052432,40,3,5.1133946443706555e-05,,,,,,PRUNED
253,0.48400770313146096,2026-05-03 10:05:10.649565,2026-05-03 10:05:37.997517,0 days 00:00:27.347952,32,True,80,0.20389805990925813,,6,192,0.03291382958061441,0.0007855798157524277,ce,1.5765409822372738,0.1795785248271271,0.34490724277518353,0.4793482552051081,2,1,1,plateau,1.1,0.9,0.11438024802061374,24,3,3.214037147490271e-05,,,,,,PRUNED
254,0.5026959937658938,2026-05-03 10:05:38.096582,2026-05-03 10:06:04.879216,0 days 00:00:26.782634,32,True,48,0.21516862535554285,,4,256,0.0664667912158443,0.0007203352294887495,ce,1.6202646798275762,0.1733349770933814,0.32198983240770257,0.4612042768616234,2,1,1,plateau,1.1,0.9,0.23327631521576392,36,2,0.00027133929111427044,,,,,,PRUNED
255,0.5735134231822551,2026-05-03 10:06:04.988322,2026-05-03 10:06:58.659410,0 days 00:00:53.671088,32,True,80,0.20777879174120426,,6,192,0.03506535564615914,0.0006683116881707635,ce,1.516045281152672,0.19252708814352584,0.27667044213399283,0.4510063398962735,2,1,1,plateau,1.1,0.9,0.10473968287068611,24,3,3.720222520763947e-05,,,,,,PRUNED
256,0.4363751070931249,2026-05-03 10:06:58.761457,2026-05-03 10:07:33.308828,0 days 00:00:34.547371,32,True,80,0.3006964909588283,,10,192,0.04141931453999442,0.0003417991432145526,ce,1.658699361229007,0.186876079241858,0.1884395470219177,0.33005110905792095,2,3,2,plateau,1.1,0.9,0.08627949202704938,32,2,5.200592244422977e-05,,,,,,PRUNED
257,0.5638800033259057,2026-05-03 10:07:33.415920,2026-05-03 10:08:17.564961,0 days 00:00:44.149041,32,False,48,0.20441139045954668,,10,192,0.031222377073182338,0.0007517038046084673,ce,1.7013004485652803,0.15148903731192886,0.3141215648805431,0.4577235436331805,2,1,1,plateau,1.1,0.9,0.24566803963024564,24,3,7.093286764493862e-05,,,,,,PRUNED
258,0.6607243354145111,2026-05-03 10:08:17.672142,2026-05-03 10:10:54.164699,0 days 00:02:36.492557,32,True,80,0.21929566864663258,,6,192,0.036561453210733556,0.0007654116256878052,ce,1.557851509440227,0.18118795850385602,0.2903601746421234,0.2635957857627705,2,1,1,plateau,1.1,0.9,0.23800719583210164,24,2,2.9459207318973363e-05,[0.6607243354145111],[1.0599011531550822],0.6607243354145111,0.6607243354145111,0.0,COMPLETE
259,0.6698245156069793,2026-05-03 10:10:54.265155,2026-05-03 10:13:23.691934,0 days 00:02:29.426779,32,True,80,0.21115403236682426,,10,192,0.03342650571135068,0.0007147385757344546,ce,1.6050243542917297,0.1701081699013294,0.3267708676878368,0.4394764072459264,2,1,1,plateau,1.1,0.9,0.11493310133362236,24,2,2.605360750738158e-05,[0.6698245156069793],[1.0390156620412137],0.6698245156069793,0.6698245156069793,0.0,COMPLETE
260,0.5050898736353179,2026-05-03 10:13:23.791200,2026-05-03 10:13:50.648829,0 days 00:00:26.857629,32,True,80,0.2002246703107454,,10,192,0.03326269704557901,0.0008103864914502003,ce,1.5896836950013036,0.1728262957239955,0.3310605560805515,0.43971212785077385,2,1,1,plateau,1.1,0.9,0.12347975701704098,24,2,0.00031888234474821054,,,,,,PRUNED
261,0.45986612531425125,2026-05-03 10:13:50.748686,2026-05-03 10:14:25.114859,0 days 00:00:34.366173,32,True,80,0.30075501885562983,,10,192,0.04106490648368356,0.0007281228369420881,ce,1.6109904086049067,0.16993944933657312,0.33882663351798437,0.35390606252337403,2,3,2,plateau,1.1,0.9,0.11487686442904105,28,3,5.1245003759483225e-05,,,,,,PRUNED
262,0.6273919223815648,2026-05-03 10:14:25.219169,2026-05-03 10:15:57.111213,0 days 00:01:31.892044,32,True,80,0.21108245420990385,,6,192,0.03201926786535209,0.0008538143204060607,ce,1.6395011594536424,0.17909711370226933,0.3264972371816277,0.33730724398090317,2,1,1,plateau,1.1,0.9,0.22686619614706177,24,2,2.6322110068212367e-05,,,,,,PRUNED
263,0.6728737792462629,2026-05-03 10:15:57.209244,2026-05-03 10:19:09.974915,0 days 00:03:12.765671,32,False,80,0.20830357459614904,,10,192,0.033759201439387446,0.0007822520543141186,ce,1.28125601644511,0.13714246271928468,0.3220846568677244,0.4283224154581364,2,1,1,plateau,1.1,0.9,0.11850483021388825,24,2,2.2673258290103445e-05,[0.6728737792462629],[1.0765585190386509],0.6728737792462629,0.6728737792462629,0.0,COMPLETE
264,0.5704402494073706,2026-05-03 10:19:10.077146,2026-05-03 10:20:03.952840,0 days 00:00:53.875694,32,False,80,0.20839889976942788,2.126534397179169,10,192,0.0345872908006811,0.0007931104478108037,focal,1.5407273708243703,0.13608855785590576,0.32220359901216244,0.4295484499838754,2,1,1,plateau,1.1,0.9,0.21575537865613256,24,2,2.285551128721032e-05,,,,,,PRUNED
265,0.6110181728825279,2026-05-03 10:20:04.052732,2026-05-03 10:21:40.386853,0 days 00:01:36.334121,32,False,80,0.21287438563804081,,10,192,0.030692041047598286,0.0008946496327823382,ce,1.2801558853857042,0.18472661247305386,0.33764598000133533,0.4730750306656742,2,1,1,plateau,1.1,0.9,0.12153054674201777,24,2,2.5047283102407344e-05,,,,,,PRUNED
266,0.6310070496816199,2026-05-03 10:21:40.494982,2026-05-03 10:23:32.140517,0 days 00:01:51.645535,32,False,80,0.2047250044031988,,6,192,0.03314311236996123,0.0007753947946896072,ce,1.459906512499621,0.14178883498191772,0.32934223375971466,0.23865896089328645,2,1,1,plateau,1.1,0.9,0.1170134221158767,24,2,2.2989990992662608e-05,,,,,,PRUNED
267,0.4966208212516364,2026-05-03 10:23:32.248602,2026-05-03 10:23:59.191451,0 days 00:00:26.942849,32,False,80,0.2156611059496072,,10,192,0.03536771471732275,0.0009572846480354822,ce,1.7281427028076777,0.1908435433075799,0.3013390769676689,0.4342719902829762,2,1,1,plateau,1.1,0.9,0.13161840053672305,24,2,1.9926083645924458e-05,,,,,,PRUNED
268,0.5351242463123956,2026-05-03 10:23:59.288712,2026-05-03 10:24:45.483487,0 days 00:00:46.194775,32,False,80,0.20871703301693506,,10,192,0.029805767492206127,0.000853765681062807,ce,1.5853882344652335,0.12285817777595279,0.36799665765218514,0.43762801324167766,2,1,1,plateau,1.1,0.9,0.11168896301539588,24,2,2.8896690427214677e-05,,,,,,PRUNED
269,0.6506966059070548,2026-05-03 10:24:45.582034,2026-05-03 10:27:07.890566,0 days 00:02:22.308532,32,False,80,0.20574647076973201,,6,192,0.03399150116005637,0.0009539403723820597,ce,1.257692316511913,0.1145468336369769,0.3477761213476932,0.2889912055978355,2,1,1,plateau,1.1,0.9,0.24982937477791256,24,2,2.0792590139698746e-05,[0.6506966059070548],[1.0704220583398851],0.6506966059070548,0.6506966059070548,0.0,COMPLETE
270,0.6176792289916411,2026-05-03 10:27:08.008550,2026-05-03 10:28:28.543781,0 days 00:01:20.535231,32,False,80,0.20016623185278518,,10,192,0.05550682465653164,0.0009964608158204982,ce,1.498782208763292,0.13024238665074397,0.3165138467340214,0.34296514941150613,2,1,1,plateau,1.1,0.9,0.15275438323399865,24,2,0.0006733218405613609,,,,,,PRUNED
271,0.6808203036517195,2026-05-03 10:28:28.644070,2026-05-03 10:31:25.230781,0 days 00:02:56.586711,32,True,80,0.21962552936706028,,10,192,0.023094558324301982,0.0008277900203830596,ce,1.7622116913713541,0.17527499220208903,0.17313017717282347,0.4449755054364561,2,1,1,plateau,1.1,0.9,0.16192416145815836,24,2,2.5799150198457592e-05,[0.6808203036517195],[1.0403179239026077],0.6808203036517195,0.6808203036517195,0.0,COMPLETE
272,0.6565311202642394,2026-05-03 10:31:25.332086,2026-05-03 10:34:13.286075,0 days 00:02:47.953989,32,True,80,0.22088389670989128,,4,192,0.023350878804832942,0.0008156394822132954,ce,1.785484366614754,0.1765810618733736,0.1664870931757732,0.44240185374437874,1,1,1,plateau,1.1,0.9,0.14975561617628785,24,2,0.00025221149573835115,[0.6565311202642394],[1.0488562360941935],0.6565311202642394,0.6565311202642394,0.0,COMPLETE
273,0.49361447959604593,2026-05-03 10:34:13.391885,2026-05-03 10:34:45.397321,0 days 00:00:32.005436,32,True,80,0.3007295064034866,,10,320,0.04139079550467516,0.0007679259438258438,ce,1.8124983476051715,0.1706788392918292,0.17102631827293363,0.4479300234013423,2,1,2,plateau,1.1,0.9,0.1593061547969993,48,2,5.122268471110959e-05,,,,,,PRUNED
274,0.5865263949472023,2026-05-03 10:34:45.502720,2026-05-03 10:35:43.258852,0 days 00:00:57.756132,32,False,80,0.21728760484399676,,6,192,0.025456758214943618,0.0008399241543912282,ce,1.766148405246929,0.13197662089970172,0.44644486827425023,0.4319430413833853,2,1,1,plateau,1.1,0.9,0.14021371345608985,24,2,2.430329254030658e-05,,,,,,PRUNED
275,0.5155218251091074,2026-05-03 10:35:43.388944,2026-05-03 10:36:17.902914,0 days 00:00:34.513970,32,True,80,0.20478479610438374,,10,192,0.022237079694288026,0.0007061408019638966,ce,1.8700839118837838,0.17486381137578652,0.17436066391064423,0.45409340714827634,2,1,1,plateau,1.1,0.9,0.12630957257021216,24,2,2.644231870240689e-05,,,,,,PRUNED
276,0.67951163967854,2026-05-03 10:36:18.000932,2026-05-03 10:39:44.828237,0 days 00:03:26.827305,32,True,80,0.21069619151486907,,10,192,0.02478568691821507,0.0007389803549327135,ce,1.6796437277054954,0.1805964499228121,0.15736523789259427,0.1774246817992278,2,1,1,plateau,1.1,0.9,0.16758797246121004,24,2,2.5209192416064004e-05,[0.67951163967854],[1.0689203661980389],0.67951163967854,0.67951163967854,0.0,COMPLETE
277,0.4550990496839939,2026-05-03 10:39:44.929257,2026-05-03 10:40:13.303039,0 days 00:00:28.373782,32,True,80,0.30066730166807215,,12,256,0.04143403332887954,0.0007477932513065387,ce,1.8399895397067767,0.1850574708076085,0.1225513090484042,0.1522725599744844,4,1,2,plateau,1.1,0.9,0.16622931364380106,44,3,5.1080459542434364e-05,,,,,,PRUNED
278,0.5047973066716741,2026-05-03 10:40:13.429054,2026-05-03 10:40:44.021007,0 days 00:00:30.591953,32,True,80,0.2096343473571189,,6,192,0.024191195141078363,0.0007927861258843246,ce,1.7482469217435102,0.18039545765804485,0.39204704333323626,0.19161735243024894,1,1,1,plateau,1.1,0.9,0.16852174466507913,24,2,2.5258812798438063e-05,,,,,,PRUNED
279,0.6693675225577128,2026-05-03 10:40:44.119573,2026-05-03 10:43:14.019329,0 days 00:02:29.899756,32,True,80,0.2040678676692523,,10,192,0.02668876003721882,0.0007198099495232144,ce,1.677143213878875,0.1770222834813955,0.15648591149311325,0.18043405935583684,2,1,1,plateau,1.1,0.9,0.15777947071782228,24,3,2.2869515925562703e-05,[0.6693675225577128],[1.0360490225201888],0.6693675225577128,0.6693675225577128,0.0,COMPLETE
280,0.6004093588963438,2026-05-03 10:43:14.120661,2026-05-03 10:44:19.315201,0 days 00:01:05.194540,32,True,80,0.20350394115180476,,10,192,0.027744115975525598,0.0007188580330427711,ce,1.6771499426236707,0.17976244767575142,0.1592738059945198,0.1735146936584889,2,1,1,plateau,1.1,0.9,0.1617456354082265,24,3,2.161555524877368e-05,,,,,,PRUNED
281,0.5642741623044224,2026-05-03 10:44:19.413947,2026-05-03 10:45:13.186118,0 days 00:00:53.772171,32,True,80,0.20380881293892789,,10,192,0.02020432944450891,0.000681201309502974,ce,1.6760587309900632,0.1757522065973151,0.15940875728178835,0.17622388882572368,2,1,1,plateau,1.1,0.9,0.15274695755628392,24,3,2.2616520776843793e-05,,,,,,PRUNED
282,0.67692495577496,2026-05-03 10:45:13.284734,2026-05-03 10:47:39.560894,0 days 00:02:26.276160,32,True,80,0.2002119733166017,,10,192,0.0257437810105039,0.0007401586658980457,ce,1.722292858459565,0.1823584223765294,0.42919726203115105,0.18358543763620605,2,1,1,plateau,1.1,0.9,0.15859814410152923,24,3,1.8291971953515795e-05,[0.67692495577496],[1.0528659769099393],0.67692495577496,0.67692495577496,0.0,COMPLETE
283,0.6695014235682116,2026-05-03 10:47:39.661681,2026-05-03 10:50:36.038014,0 days 00:02:56.376333,32,True,80,0.20030263299224244,,10,192,0.02872489747877082,0.0007441864975051109,ce,1.7298289834450595,0.18490202197492894,0.48462570582253384,0.15599393787767105,2,1,1,plateau,1.1,0.9,0.1743002086144968,24,3,1.7324195912802195e-05,[0.6695014235682116],[1.0804750124613445],0.6695014235682116,0.6695014235682116,0.0,COMPLETE
284,0.4982545880554475,2026-05-03 10:50:36.141112,2026-05-03 10:51:10.780876,0 days 00:00:34.639764,32,True,80,0.20076190224802143,,10,192,0.02658261285442956,0.0007508796087080821,ce,1.7153325149000815,0.18383098944682036,0.42862789050129635,0.15844170109924005,2,1,1,plateau,1.1,0.9,0.1723189153361287,32,3,2.070139130484942e-05,,,,,,PRUNED
285,0.5083496964837517,2026-05-03 10:51:10.881739,2026-05-03 10:51:38.075802,0 days 00:00:27.194063,32,True,80,0.20009992040552302,2.4095153420767836,10,192,0.02541475221582836,0.0006451331852384039,focal,1.7051935136608802,0.1840942922188848,0.15535980647852768,0.16198092693382032,2,1,1,plateau,1.1,0.9,0.18000656003046359,24,3,1.8263134646203056e-05,,,,,,PRUNED
286,0.5652622617461633,2026-05-03 10:51:38.180520,2026-05-03 10:52:28.081773,0 days 00:00:49.901253,32,True,80,0.2000730214913954,,10,192,0.0235546281736633,0.0007120252998305407,ce,1.7415536428462992,0.18825937317884647,0.15043448330577874,0.16641486137325368,2,1,1,plateau,1.1,0.9,0.15834147050560693,24,3,1.563631813604162e-05,,,,,,PRUNED
