number,value,datetime_start,datetime_complete,duration,params_batch_size,params_class_weighting,params_cnn_channels,params_dropout,params_focal_gamma,params_freq_mask_param,params_hidden_size,params_label_smoothing,params_learning_rate,params_loss_type,params_max_grad_norm,params_min_lr_ratio,params_mixup_alpha,params_mixup_prob,params_num_freq_masks,params_num_layers,params_num_time_masks,params_scheduler_type,params_speed_perturb_max,params_speed_perturb_min,params_speed_perturb_prob,params_time_mask_param,params_warmup_epochs,params_weight_decay,user_attrs_repeat_best_f1s,user_attrs_repeat_best_losses,user_attrs_repeat_mean_f1,user_attrs_repeat_robust_score,user_attrs_repeat_std_f1,state
113,0.5047503673695796,2026-05-03 07:36:44.004765,2026-05-03 07:37:12.198864,0 days 00:00:28.194099,64,False,48,0.20907921498425666,,4,192,0.03418317197569373,0.0008195718439072463,ce,0.6290166688702387,0.20563352071642507,0.2874824622242639,0.22689881089063285,2,1,1,plateau,1.1,0.9,0.17215967366163604,24,2,3.924808296746583e-05,,,,,,PRUNED
114,0.5022338129440905,2026-05-03 07:37:12.322786,2026-05-03 07:37:40.713231,0 days 00:00:28.390445,64,False,48,0.20390360119363513,,10,192,0.02442023533736829,0.0009100176698083989,ce,0.6600319309803593,0.17505045769299096,0.2641333369108094,0.17109426252189985,2,1,1,plateau,1.1,0.9,0.08988221736719779,24,3,3.1952894432650505e-05,,,,,,PRUNED
115,0.503171042656842,2026-05-03 07:37:40.809989,2026-05-03 07:38:11.277680,0 days 00:00:30.467691,64,True,80,0.22852266588803574,,6,192,0.027370120068015886,0.0006586057226192976,ce,1.131103911551714,0.19040163304059346,0.28007826715625606,0.11645943042728249,1,1,1,warmup_cosine,1.1,0.9,0.1111703083853376,28,4,1.4473015380545264e-05,,,,,,PRUNED
116,0.45862832881528437,2026-05-03 07:38:11.374881,2026-05-03 07:38:36.992420,0 days 00:00:25.617539,64,True,48,0.21877812230343446,,10,192,0.03048021038888619,0.0007332739194714124,ce,1.2731577592280312,0.22900990498375887,0.3018607723859513,0.4101125377846369,2,3,1,warmup_cosine,1.1,0.9,0.13931007061576228,24,3,2.2482135910618066e-05,,,,,,PRUNED
117,0.45438359683377455,2026-05-03 07:38:37.100223,2026-05-03 07:39:01.089573,0 days 00:00:23.989350,64,False,80,0.3011738716599704,,16,320,0.04217421067645195,0.0007778927715778546,ce,1.5667286789704125,0.1697626488871123,0.2170614536199712,0.4717497022612085,2,1,2,warmup_cosine,1.1,0.9,0.10597583538200593,28,4,5.1728080052861966e-05,,,,,,PRUNED
118,0.4907433304461638,2026-05-03 07:39:01.190111,2026-05-03 07:39:26.926033,0 days 00:00:25.735922,64,True,48,0.24088642738588686,,6,192,0.03946517851273968,0.0008492945345923204,ce,1.6308227096714554,0.2849804265531903,0.374506331877778,0.4182724198960034,1,3,1,plateau,1.1,0.9,0.09704868248638629,20,8,1.919911488444617e-05,,,,,,PRUNED
119,0.6762388822484771,2026-05-03 07:39:27.023503,2026-05-03 07:42:15.174978,0 days 00:02:48.151475,64,True,80,0.20006254571335003,,10,192,0.0373032039555291,0.0006863313576024814,ce,0.8346249939123959,0.14441463113575592,0.315676304825696,0.4396974250084763,2,1,1,warmup_cosine,1.1,0.9,0.12432012017092325,24,2,9.996223191550875e-05,[0.6762388822484771],[1.110921645336014],0.6762388822484771,0.6762388822484771,0.0,COMPLETE
120,0.6538266242888083,2026-05-03 07:42:15.272052,2026-05-03 07:44:15.592199,0 days 00:02:00.320147,64,True,80,0.20982701026567863,,10,192,0.03666365392670916,0.0006370952812295185,ce,0.7721629041402202,0.14490808598189683,0.31973749579297917,0.39757799571052416,2,1,1,warmup_cosine,1.1,0.9,0.134237955508887,24,2,0.00010859430375126576,[0.6538266242888083],[1.03670301604614],0.6538266242888083,0.6538266242888083,0.0,COMPLETE
121,0.4265836540454594,2026-05-03 07:44:15.707431,2026-05-03 07:44:43.289245,0 days 00:00:27.581814,64,True,48,0.3011845482871032,2.472890977651541,10,256,0.04418170690767617,0.0006996882849345192,focal,1.3386490375674382,0.14108880030067011,0.2945405179913271,0.4402774626108658,3,3,2,warmup_invsqrt,1.1,0.9,0.12446676678968861,32,2,5.677517948144289e-05,,,,,,PRUNED
122,0.5782776613277119,2026-05-03 07:44:43.398219,2026-05-03 07:45:43.360457,0 days 00:00:59.962238,64,True,80,0.21230663020377027,,10,192,0.03235913947395651,0.0007388032773122751,ce,0.8407832834059312,0.15711081311964173,0.350267800540321,0.4291375524196255,2,1,1,warmup_cosine,1.1,0.9,0.1493692750287443,24,2,9.845261357728147e-05,,,,,,PRUNED
123,0.48647738026635173,2026-05-03 07:45:43.461826,2026-05-03 07:46:07.015942,0 days 00:00:23.554116,64,True,80,0.20138469303536544,,10,192,0.038055813869166746,0.0006075240781176963,ce,0.8898392081872527,0.1499937154308757,0.2746986906805241,0.4569826131687517,2,1,1,warmup_cosine,1.1,0.9,0.11649425678865445,36,2,8.666931883914391e-05,,,,,,PRUNED
124,0.6608579266917458,2026-05-03 07:46:07.112521,2026-05-03 07:48:24.193797,0 days 00:02:17.081276,64,True,80,0.20643387726686274,,10,192,0.029020804674372406,0.0008036566000177174,ce,1.0280355848453684,0.16665759611740946,0.3298104234536652,0.42255071722767346,2,1,1,warmup_cosine,1.1,0.9,0.12807844507599192,24,3,0.00011621509893200333,[0.6608579266917458],[1.0427424101520786],0.6608579266917458,0.6608579266917458,0.0,COMPLETE
125,0.6532033119305923,2026-05-03 07:48:24.295113,2026-05-03 07:51:08.112611,0 days 00:02:43.817498,64,True,80,0.20013668508602803,,10,192,0.034721998845359446,0.0007966737487324369,ce,1.051702451221219,0.1765121108970033,0.3274626255299271,0.3243063939450581,2,1,1,warmup_cosine,1.1,0.9,0.12876152811486113,24,3,0.00015380420810667776,[0.6532033119305923],[1.1629090028986941],0.6532033119305923,0.6532033119305923,0.0,COMPLETE
126,0.6040322139495344,2026-05-03 07:51:08.213328,2026-05-03 07:52:18.326295,0 days 00:01:10.112967,64,True,80,0.20703028092503076,,10,192,0.030132042119782078,0.0008447215622161851,ce,1.1565945123999002,0.16687573798024954,0.31517887936566596,0.4065669869175159,2,1,1,warmup_cosine,1.1,0.9,0.14190276964421888,24,3,0.0001300219916737529,,,,,,PRUNED
127,0.5185341364181065,2026-05-03 07:52:18.421223,2026-05-03 07:53:04.498944,0 days 00:00:46.077721,32,True,80,0.2175307411809431,,10,192,0.03328230886335147,0.0009096180450433029,ce,0.609224806124707,0.16554356107627188,0.33467623168668886,0.4226692822079847,2,1,1,warmup_cosine,1.1,0.9,0.13445251627781185,24,3,0.00011962929930062759,,,,,,PRUNED
128,0.4643220519692376,2026-05-03 07:53:04.605739,2026-05-03 07:53:29.859496,0 days 00:00:25.253757,64,False,48,0.21324502051911343,,10,192,0.040253111598809226,0.0009730181362922411,ce,1.0174149776580401,0.1335078512332071,0.2966187947995414,0.10235197130281182,2,3,1,warmup_cosine,1.1,0.9,0.12249007210831957,20,3,0.00022346897958643844,,,,,,PRUNED
129,0.662910648960588,2026-05-03 07:53:29.956949,2026-05-03 07:55:48.888402,0 days 00:02:18.931453,64,True,64,0.22511617923380667,,10,192,0.037586941615198835,0.000679154780609489,ce,0.6856275902367073,0.16171701897743382,0.31178906186071426,0.44783869139277155,2,1,1,warmup_cosine,1.1,0.9,0.10581779767870965,24,2,0.00011150513692170018,[0.662910648960588],[1.0290334935096814],0.662910648960588,0.662910648960588,0.0,COMPLETE
130,0.472983970103719,2026-05-03 07:55:48.997263,2026-05-03 07:56:12.139170,0 days 00:00:23.141907,64,True,64,0.2249507929760451,,10,192,0.03759376986678651,0.0006790836619257195,ce,0.9363324372130801,0.15498493179506365,0.3090687666605612,0.44566982341058153,2,1,1,warmup_cosine,1.1,0.9,0.08516126431089185,24,2,0.0001146032027373372,,,,,,PRUNED
131,0.47066347324557256,2026-05-03 07:56:12.235742,2026-05-03 07:56:38.334290,0 days 00:00:26.098548,64,True,64,0.30115649032447295,,12,192,0.042259902440280425,0.0007170318441473108,ce,1.8015328675787279,0.12494546254184022,0.3640852959821622,0.2997230020676679,2,3,2,plateau,1.1,0.9,0.10556589950724729,28,2,6.229782866737642e-05,,,,,,PRUNED
132,0.6761466907310171,2026-05-03 07:56:38.433999,2026-05-03 07:59:08.374139,0 days 00:02:29.940140,64,True,80,0.20576434632079002,,10,192,0.03526263589791531,0.0007520010467193404,ce,0.692738152231549,0.16191748012558047,0.3243702713080879,0.46865131861101667,2,1,1,warmup_cosine,1.1,0.9,0.11284624185660039,24,2,0.00015425188772123945,[0.6761466907310171],[1.0717942287310136],0.6761466907310171,0.6761466907310171,0.0,COMPLETE
133,0.49176781919794677,2026-05-03 07:59:08.472166,2026-05-03 07:59:34.979964,0 days 00:00:26.507798,64,True,64,0.20599676251265422,,10,192,0.028861635552970114,0.0007628783217074979,ce,0.6777298480562224,0.16099295453559742,0.3263864346271584,0.46657457702955796,2,1,1,warmup_cosine,1.1,0.9,0.09767697942003217,24,2,0.0001772593201056365,,,,,,PRUNED
134,0.6208519876459391,2026-05-03 07:59:35.075982,2026-05-03 08:01:00.963947,0 days 00:01:25.887965,64,True,64,0.20949254029984204,,10,192,0.03518377989283677,0.0008114081952833203,ce,0.5689670988053764,0.14531128356232595,0.34432836686900214,0.4357603675514738,2,1,1,warmup_cosine,1.1,0.9,0.11771202719234043,24,2,0.00015489393751341884,,,,,,PRUNED
135,0.5824067155918728,2026-05-03 08:01:01.061577,2026-05-03 08:01:50.629142,0 days 00:00:49.567565,64,True,64,0.21597167215565122,,10,192,0.03862467321528862,0.0006785060383419115,ce,0.615155388713106,0.16262758144225986,0.3533432485164564,0.4510886739904262,2,1,1,warmup_cosine,1.1,0.9,0.1133771214673994,24,2,0.00010295147135535496,,,,,,PRUNED
136,0.48927140036243605,2026-05-03 08:01:50.729400,2026-05-03 08:02:13.982841,0 days 00:00:23.253441,64,True,80,0.23396163806159187,,10,192,0.02637354394227672,0.0007614640042463258,ce,1.2182643184060404,0.17281827682512121,0.33713285634041346,0.3987918737480666,2,1,1,warmup_cosine,1.1,0.9,0.10826537332262824,24,2,9.255730018018986e-05,,,,,,PRUNED
137,0.39935530861137913,2026-05-03 08:02:14.081090,2026-05-03 08:02:38.552688,0 days 00:00:24.471598,64,True,48,0.20308431421119552,,10,192,0.03681998539422895,0.00013593117492767038,ce,0.7157057909443811,0.15154827519608532,0.30370172928054917,0.41654971250395145,2,2,1,warmup_cosine,1.1,0.9,0.09319975370493098,24,2,0.00018039834971367958,,,,,,PRUNED
138,0.504907002075341,2026-05-03 08:02:38.658059,2026-05-03 08:03:08.573680,0 days 00:00:29.915621,64,True,80,0.22010645966730905,,10,192,0.032486626939656864,0.0008616253575045337,ce,0.8239542295154259,0.2950638263627157,0.3182837472751401,0.43827057611428394,2,1,1,warmup_cosine,1.1,0.9,0.07925522222891476,24,3,7.864843494554175e-05,,,,,,PRUNED
139,0.4709846579442959,2026-05-03 08:03:08.688921,2026-05-03 08:03:51.075190,0 days 00:00:42.386269,32,True,48,0.2089459266571448,,10,192,0.03924666339211131,0.00072150207289593,ce,1.0940428704875824,0.27625157706993136,0.19539510212781205,0.45615015184977364,2,3,1,warmup_cosine,1.1,0.9,0.10001092153278938,24,2,0.00014298113180905185,,,,,,PRUNED
140,0.6215835970338203,2026-05-03 08:03:51.175849,2026-05-03 08:05:16.131973,0 days 00:01:24.956124,64,False,80,0.2265172869781789,,10,192,0.031012727756988084,0.0006547678441637276,ce,0.6512660888340015,0.13840398309160898,0.28819436437208934,0.4752333756051705,2,1,1,warmup_cosine,1.1,0.9,0.28224171730210806,36,3,6.997531452657561e-05,,,,,,PRUNED
141,0.5043903244634254,2026-05-03 08:05:16.229520,2026-05-03 08:05:45.978024,0 days 00:00:29.748504,64,True,48,0.21325185947533948,,10,320,0.02432164909619601,0.0007994194829246897,ce,0.7719458999182163,0.16626547245234374,0.328349546277818,0.3742869661724955,2,1,1,warmup_cosine,1.1,0.9,0.12179197100801084,24,2,0.00020714003887098285,,,,,,PRUNED
142,0.45786295610583505,2026-05-03 08:05:46.074928,2026-05-03 08:06:09.448775,0 days 00:00:23.373847,64,True,80,0.2207164799831757,,6,192,0.0350225147701716,0.0004545752059003929,ce,0.6966488020616596,0.177726458977392,0.3098673081525941,0.4640537772746704,2,1,1,warmup_cosine,1.1,0.9,0.12944624728864473,20,3,0.0001264291924641369,,,,,,PRUNED
143,0.4859603658006671,2026-05-03 08:06:09.548051,2026-05-03 08:06:32.922036,0 days 00:00:23.373985,64,True,80,0.2006626611339533,,10,192,0.03656042121555129,0.0005777778419404846,ce,0.7451926239321341,0.1861145123047302,0.1793514096257798,0.4295067550673384,2,1,1,warmup_cosine,1.1,0.9,0.1138447817552918,20,4,0.00011492563417539287,,,,,,PRUNED
144,0.4697226018464724,2026-05-03 08:06:33.017594,2026-05-03 08:06:56.545664,0 days 00:00:23.528070,64,True,80,0.20613834095729422,,6,192,0.021949311632084783,0.0007087757031033646,ce,1.6858988555407324,0.1590086045852521,0.16773408704111004,0.448024194652849,2,1,1,warmup_cosine,1.1,0.9,0.136056838728913,24,3,1.6993004610301207e-05,,,,,,PRUNED
145,0.461473249153929,2026-05-03 08:06:56.649370,2026-05-03 08:07:26.926194,0 days 00:00:30.276824,64,True,80,0.21412966226246893,,10,192,0.04037447435793921,0.0006422050702411392,ce,0.6466554813602364,0.18123316517657476,0.2987580968933054,0.4885292097007384,2,1,1,warmup_cosine,1.1,0.9,0.10275016544140678,20,2,2.6308160003379184e-05,,,,,,PRUNED
146,0.4682288365647875,2026-05-03 08:07:27.022211,2026-05-03 08:07:53.355354,0 days 00:00:26.333143,64,True,80,0.3009236544920941,2.007507335753389,14,192,0.04477580553225251,0.0007537430930199106,focal,1.3939299489602575,0.17217568944190573,0.3219176718003262,0.47782573692679514,2,3,3,plateau,1.1,0.9,0.15369797034052718,44,3,0.00026934026248759906,,,,,,PRUNED
147,0.445432335363154,2026-05-03 08:07:53.452485,2026-05-03 08:08:16.715235,0 days 00:00:23.262750,64,True,64,0.22361053414654133,,6,192,0.034364514842498695,0.0006168642174234316,ce,1.4785731578590098,0.19199899092810896,0.28769166884709096,0.42396204891151307,2,1,1,warmup_cosine,1.1,0.9,0.1274225825018072,24,4,8.227613767404134e-05,,,,,,PRUNED
148,0.39482608066702807,2026-05-03 08:08:16.817750,2026-05-03 08:08:43.488608,0 days 00:00:26.670858,64,True,80,0.30103156954459553,,12,192,0.04226912434152914,0.0008929923304872963,ce,0.7115477475691195,0.28608477415633093,0.15192242455654847,0.4116727625369678,4,3,2,warmup_cosine,1.1,0.9,0.14172007451121635,28,7,5.163343708390417e-05,,,,,,PRUNED
149,0.5824295055021314,2026-05-03 08:08:43.592760,2026-05-03 08:09:31.336619,0 days 00:00:47.743859,64,True,48,0.23157667423594414,,10,192,0.02897975478627252,0.0009985994381907302,ce,0.6795715455296647,0.2662962252833741,0.1881806351267885,0.3859635666150234,2,1,1,warmup_invsqrt,1.1,0.9,0.118547482104535,24,3,9.82907585774584e-05,,,,,,PRUNED
150,0.5768057361838614,2026-05-03 08:09:31.449748,2026-05-03 08:10:31.537537,0 days 00:01:00.087789,32,False,80,0.30099829057818633,,8,256,0.047557350703966716,0.0008269720162864183,ce,0.9720414829551027,0.06211358023813621,0.4001970845136403,0.43419405505495645,3,1,4,warmup_cosine,1.1,0.9,0.11091005692962344,28,4,5.139080650691875e-05,,,,,,PRUNED
151,0.47420009143185127,2026-05-03 08:10:31.635377,2026-05-03 08:10:57.408978,0 days 00:00:25.773601,64,True,48,0.2098310329988354,,4,192,0.03332421225980842,0.00026981243502847627,ce,0.5932398065036608,0.18569255871921037,0.2045095249854717,0.4590876863278056,2,3,1,warmup_cosine,1.1,0.9,0.09149559422396528,20,2,0.00014203137139632633,,,,,,PRUNED
152,0.4469616823484031,2026-05-03 08:10:57.510392,2026-05-03 08:11:21.035794,0 days 00:00:23.525402,64,True,80,0.2484880098049434,,8,192,0.026095350813356868,0.0006902588284154714,ce,0.9312952164561128,0.20076927323000415,0.22479692115655034,0.4426454962297732,1,1,1,warmup_cosine,1.1,0.9,0.03292277989291961,24,5,3.090040533655946e-05,,,,,,PRUNED
153,0.4712611406185877,2026-05-03 08:11:21.136460,2026-05-03 08:11:44.690612,0 days 00:00:23.554152,64,True,80,0.20003635132873068,,8,192,0.028154769927257246,0.0007825206523281366,ce,1.0314025679081729,0.2165015436046072,0.2561630681922257,0.42020067515513493,2,1,1,warmup_cosine,1.1,0.9,0.04824861210506304,24,5,3.542897891805391e-05,,,,,,PRUNED
154,0.4693715318614492,2026-05-03 08:11:44.796932,2026-05-03 08:12:08.133577,0 days 00:00:23.336645,64,True,80,0.21773579259177697,,10,192,0.030888085020879117,0.0007334117990739951,ce,0.7937178508382604,0.1973500961007415,0.23893638083757976,0.49264798028334356,2,1,1,warmup_cosine,1.1,0.9,0.12251408418886067,24,5,2.020238895926611e-05,,,,,,PRUNED
155,0.4259749963889613,2026-05-03 08:12:08.240344,2026-05-03 08:12:31.881223,0 days 00:00:23.640879,64,True,80,0.26520255570830237,,6,192,0.03789669255317593,0.0003120086461993461,ce,1.7443640229430954,0.16829352880736612,0.20938229189633828,0.42781429121639314,1,1,1,warmup_cosine,1.1,0.9,0.054657418587121746,24,3,2.9296868368905854e-05,,,,,,PRUNED
156,0.5951608771702875,2026-05-03 08:12:31.976724,2026-05-03 08:13:41.907069,0 days 00:01:09.930345,64,True,80,0.23787050571248855,,10,192,0.03583922559944401,0.0006959241485867767,ce,0.9876815924558708,0.1793133246196755,0.41438639562441887,0.40561436964153674,2,1,1,plateau,1.1,0.9,0.022786117062082185,24,3,2.3628589110179047e-05,,,,,,PRUNED
157,0.4780019772189575,2026-05-03 08:13:42.005072,2026-05-03 08:14:04.089438,0 days 00:00:22.084366,64,True,48,0.20455253380180405,,10,192,0.05680478255890814,0.00039310185554961203,ce,1.8464404004973436,0.15553384534430612,0.3155437394294579,0.35173647778606654,2,1,1,warmup_cosine,1.1,0.9,0.040779842682015364,20,5,8.600658320720309e-05,,,,,,PRUNED
158,0.4500843273583113,2026-05-03 08:14:04.196620,2026-05-03 08:14:31.065289,0 days 00:00:26.868669,64,True,80,0.3009307754039018,,8,192,0.042287832748274204,0.000672730161636286,ce,0.8723905634778409,0.1626649506735801,0.24702982006573135,0.4517295181380113,3,3,2,warmup_cosine,1.1,0.9,0.008046482930965267,40,6,5.135560152188207e-05,,,,,,PRUNED
159,0.46343166286293463,2026-05-03 08:14:31.162567,2026-05-03 08:14:55.020320,0 days 00:00:23.857753,64,False,48,0.27756317606797104,,6,192,0.03194049061390674,0.0007718473121903677,ce,0.5256209935835725,0.17182911856775296,0.19729548575124578,0.47073292240367076,2,2,1,warmup_cosine,1.1,0.9,0.10766402478405812,24,2,4.4658567373676326e-05,,,,,,PRUNED
160,0.48687521234310455,2026-05-03 08:14:55.120237,2026-05-03 08:15:18.601804,0 days 00:00:23.481567,64,True,80,0.22700213774805791,,10,192,0.027299438604506884,0.0008264520664122637,ce,1.0590225618713989,0.20719264008919183,0.21769338250130052,0.39456298536120604,1,1,1,warmup_cosine,1.1,0.9,0.1029736928751442,24,4,3.3931719946691616e-05,,,,,,PRUNED
161,0.47068994475864645,2026-05-03 08:15:18.702616,2026-05-03 08:15:42.111988,0 days 00:00:23.409372,64,True,80,0.3327895963223393,,10,192,0.07678997688638159,0.0005152429444230228,ce,1.125354836334406,0.1859457511995959,0.27453690753346277,0.43713881215785644,2,1,1,plateau,1.1,0.9,0.13178238836304418,24,3,1.569962070861246e-05,,,,,,PRUNED
162,0.4089058104842671,2026-05-03 08:15:42.212643,2026-05-03 08:16:06.796393,0 days 00:00:24.583750,64,True,64,0.30100620436359377,,8,192,0.10892858103256475,0.00022882265043559088,ce,0.6394382490535602,0.21133425243794443,0.23356172279575246,0.24728277877147906,3,2,2,warmup_invsqrt,1.1,0.9,0.14605198940408542,20,4,6.589031475173458e-05,,,,,,PRUNED
163,0.43806448198444714,2026-05-03 08:16:06.900324,2026-05-03 08:16:31.348545,0 days 00:00:24.448221,64,True,64,0.4490837898471169,,8,192,0.04163010530014602,0.000609091123504531,ce,0.7524865544113974,0.19231343630636366,0.1839044710143405,0.22329312563289455,3,2,3,warmup_invsqrt,1.1,0.9,0.2997586872217062,48,4,5.6086952166147073e-05,,,,,,PRUNED
164,0.47056169094435524,2026-05-03 08:16:31.449379,2026-05-03 08:16:55.687400,0 days 00:00:24.238021,64,True,64,0.3011105542225655,,8,192,0.12869116930795588,0.0005807669690795685,ce,0.6905946278077942,0.20287691452820975,0.2044650850344406,0.15492613405446734,3,2,3,warmup_invsqrt,1.1,0.9,0.13695676134557933,20,5,5.099872181033863e-05,,,,,,PRUNED
165,0.3693893453928422,2026-05-03 08:16:55.784190,2026-05-03 08:17:26.309337,0 days 00:00:30.525147,32,True,64,0.5420599073404724,,8,192,0.09831442807559007,0.0004250408635288526,ce,0.7283702062583067,0.2788144335881392,0.2116629464925013,0.4148543355617382,3,2,3,warmup_invsqrt,1.1,0.9,0.15800207011652306,32,4,5.1293626548315676e-05,,,,,,PRUNED
166,0.444686769728179,2026-05-03 08:17:26.422589,2026-05-03 08:17:52.775795,0 days 00:00:26.353206,64,True,64,0.3007059417097788,,8,192,0.041511220524906633,0.0006460352145537261,ce,0.8339309201923651,0.1484745771454032,0.3317282390995504,0.18653434721313544,2,3,2,warmup_cosine,1.1,0.9,0.1281046871088436,20,3,5.539579525376472e-05,,,,,,PRUNED
167,0.4109694891545483,2026-05-03 08:17:52.874777,2026-05-03 08:18:15.761719,0 days 00:00:22.886942,64,True,48,0.3854161204844867,1.5880661201057893,10,320,0.03440499359225968,0.0007285275431179142,focal,0.9096583944366424,0.19619372419987924,0.44147667618908615,0.26469018131342126,1,1,1,warmup_cosine,1.1,0.9,0.11535636366632102,20,4,7.498091858489423e-05,,,,,,PRUNED
168,0.4917526991241155,2026-05-03 08:18:15.863458,2026-05-03 08:18:41.939141,0 days 00:00:26.075683,64,False,80,0.30110018188110355,,10,192,0.04391141898443515,0.0009315777379022106,ce,0.6125113872040375,0.17418554009743456,0.3841856638477483,0.22639816004143304,3,3,4,warmup_invsqrt,1.1,0.9,0.14505378536378136,28,5,0.0004301733183800159,,,,,,PRUNED
169,0.43198123779104836,2026-05-03 08:18:42.039887,2026-05-03 08:19:04.096917,0 days 00:00:22.057030,64,True,48,0.36480019446995376,,4,192,0.03678768753508278,0.0006622097162897113,ce,0.9512257565064174,0.2917530089815699,0.3049036635552876,0.44508415158003806,1,1,1,warmup_cosine,1.1,0.9,0.015757095940140933,16,2,3.872884551259212e-05,,,,,,PRUNED
170,0.5076709306169744,2026-05-03 08:19:04.196254,2026-05-03 08:19:40.954141,0 days 00:00:36.757887,64,True,80,0.2101097592292534,,6,192,0.06219177161179473,0.0007922705640620207,ce,0.7905539085712064,0.1599603156926795,0.17270937626682142,0.3104164478398958,2,1,1,warmup_cosine,1.1,0.9,0.2444772841449682,24,3,4.32898215063718e-05,,,,,,PRUNED
171,0.47701447789372436,2026-05-03 08:19:41.063763,2026-05-03 08:20:08.334015,0 days 00:00:27.270252,64,True,48,0.3008201260067277,,8,256,0.041643384969841324,0.0007484380264248197,ce,0.6661611259311881,0.14237088249665106,0.19437759142407507,0.4281119212062714,2,3,2,plateau,1.1,0.9,0.12427478186986375,24,4,5.119104351925486e-05,,,,,,PRUNED
