number,value,datetime_start,datetime_complete,duration,params_batch_size,params_class_weighting,params_cnn_channels,params_dropout,params_focal_gamma,params_freq_mask_param,params_hidden_size,params_label_smoothing,params_learning_rate,params_loss_type,params_max_grad_norm,params_min_lr_ratio,params_mixup_alpha,params_mixup_prob,params_num_freq_masks,params_num_layers,params_num_time_masks,params_scheduler_type,params_speed_perturb_max,params_speed_perturb_min,params_speed_perturb_prob,params_time_mask_param,params_warmup_epochs,params_weight_decay,user_attrs_repeat_best_f1s,user_attrs_repeat_best_losses,user_attrs_repeat_mean_f1,user_attrs_repeat_robust_score,user_attrs_repeat_std_f1,state
172,0.4113033085319898,2026-05-03 08:20:08.436085,2026-05-03 08:20:33.885160,0 days 00:00:25.449075,64,True,48,0.20007924243814068,,10,192,0.02929803709569522,0.00011773241748352978,ce,0.7343288757164246,0.148908368330119,0.18040713375244294,0.4203601951778286,2,3,1,warmup_cosine,1.1,0.9,0.0450937628170531,24,3,0.00010959928297478128,,,,,,PRUNED
173,0.47482111300294466,2026-05-03 08:20:33.989677,2026-05-03 08:20:59.914339,0 days 00:00:25.924662,64,True,48,0.20618746677581123,,10,192,0.02429645550894635,0.0007096859979589044,ce,0.8179655189318216,0.16458303789719528,0.22108398707322705,0.2814256713960819,2,3,1,warmup_cosine,1.1,0.9,0.034866845408507915,24,3,1.7184676998386286e-05,,,,,,PRUNED
174,0.5063299159069266,2026-05-03 08:21:00.012982,2026-05-03 08:21:33.048645,0 days 00:00:33.035663,64,True,48,0.21485587413243692,,10,192,0.03908332085254034,0.0008629773310464293,ce,0.7605292162537909,0.1541274145798754,0.16491514385370132,0.4013731840752584,2,3,1,warmup_cosine,1.1,0.9,0.06316505935967298,24,3,1.3345822011380322e-05,,,,,,PRUNED
175,0.4300349338163298,2026-05-03 08:21:33.146157,2026-05-03 08:21:58.680805,0 days 00:00:25.534648,64,True,48,0.20401452451949348,,10,192,0.0273335728852434,0.0005433070866577018,ce,0.6916302801788091,0.15755245517373828,0.18979637752554684,0.433073898863728,2,3,1,warmup_cosine,1.1,0.9,0.09492919959419166,24,3,1.926388806479752e-05,,,,,,PRUNED
176,0.5742386692246931,2026-05-03 08:21:58.778358,2026-05-03 08:23:01.077575,0 days 00:01:02.299217,64,True,48,0.21029893737249625,,10,192,0.03308274745724339,0.0007505978546035979,ce,1.8982567194353086,0.1665814756341584,0.3124297754454281,0.41030928855164306,2,3,1,warmup_cosine,1.1,0.9,0.07173135375329101,20,3,2.7789611354264465e-05,,,,,,PRUNED
177,0.6032560158441057,2026-05-03 08:23:01.187954,2026-05-03 08:24:11.381919,0 days 00:01:10.193965,64,True,80,0.2162258045820457,,10,192,0.03019643049360282,0.0008036143406514467,ce,0.8577746255582585,0.18206043185387236,0.13861874969657906,0.3650007268635779,2,1,1,warmup_cosine,1.1,0.9,0.029302774205242618,24,2,9.224000451806128e-05,,,,,,PRUNED
178,0.47000370023665444,2026-05-03 08:24:11.485701,2026-05-03 08:24:41.080369,0 days 00:00:29.594668,32,False,64,0.3011159900104786,,12,192,0.04146955963276892,0.000688197995234993,ce,0.8934563357514616,0.17679970270823472,0.1606013531661494,0.13170617564789983,3,2,2,warmup_cosine,1.1,0.9,0.2650171282613258,28,3,6.589693218181556e-05,,,,,,PRUNED
179,0.4645995672593448,2026-05-03 08:24:41.178969,2026-05-03 08:25:04.545125,0 days 00:00:23.366156,64,True,80,0.40709958495741966,,10,192,0.025142891535371793,0.0006306097828160563,ce,1.1940708830707725,0.2253344072253856,0.29552228536510367,0.48141594124625,2,1,1,warmup_cosine,1.1,0.9,0.11858541633441896,24,2,2.5501452928647623e-05,,,,,,PRUNED
180,0.38520175891995984,2026-05-03 08:25:04.645808,2026-05-03 08:25:30.479005,0 days 00:00:25.833197,64,True,48,0.3490098320787988,,6,192,0.0381812314708839,0.000596669282819588,ce,0.7945246886050445,0.15298207573766306,0.22829297483238803,0.46134592294324667,2,3,1,warmup_cosine,1.1,0.9,0.13592557413983264,20,4,1.4544396828503907e-05,,,,,,PRUNED
181,0.47898505786297235,2026-05-03 08:25:30.576443,2026-05-03 08:25:53.835787,0 days 00:00:23.259344,64,True,80,0.25401029025520655,,10,192,0.03139006175402578,0.0007179227800095581,ce,0.7118828682725682,0.23780209663919566,0.17757973367854646,0.4496019539539538,2,1,1,warmup_cosine,1.1,0.9,0.08733426075967861,24,5,2.2042329789069575e-05,,,,,,PRUNED
182,0.6191086152433859,2026-05-03 08:25:53.931752,2026-05-03 08:27:04.107252,0 days 00:01:10.175500,64,True,80,0.20568008102693708,,10,192,0.02876542361696549,0.0007794898491663491,ce,0.9036189392221277,0.18896084117769235,0.2547508927796652,0.43772507099470886,1,1,1,warmup_cosine,1.1,0.9,0.03862999179252513,20,4,2.9711724500774177e-05,,,,,,PRUNED
183,0.43400387367317816,2026-05-03 08:27:04.204603,2026-05-03 08:27:27.399158,0 days 00:00:23.194555,64,True,80,0.20435185191271302,,10,192,0.02651871382303079,0.0008388972938195109,ce,0.9213046769161565,0.18923384329448473,0.2640664527706266,0.422805387411855,1,1,1,warmup_cosine,1.1,0.9,0.020157104975242358,20,4,1.8273427519752628e-05,,,,,,PRUNED
184,0.4863422743129678,2026-05-03 08:27:27.510985,2026-05-03 08:27:51.134571,0 days 00:00:23.623586,64,True,80,0.22152948450320498,,10,192,0.02170841174625622,0.0008962590019804458,ce,0.9680448770379658,0.19942421513682787,0.3213856362509539,0.43101902015287297,1,1,1,warmup_cosine,1.1,0.9,0.022914999629530027,20,4,2.70927736198904e-05,,,,,,PRUNED
185,0.5357348439880137,2026-05-03 08:27:51.235343,2026-05-03 08:28:28.156549,0 days 00:00:36.921206,64,True,80,0.2113717881371773,,10,192,0.035881318569743276,0.0007392473336735919,ce,1.0069353612802001,0.17026066507011842,0.24288990021304788,0.44180396343335426,1,1,1,warmup_cosine,1.1,0.9,0.029020868137989483,20,4,3.257396584440255e-05,,,,,,PRUNED
186,0.6830858494291612,2026-05-03 08:28:28.254851,2026-05-03 08:31:28.782995,0 days 00:03:00.528144,64,True,80,0.20106125299308247,,10,192,0.03359513436382346,0.0008102814421521665,ce,0.8591908197771063,0.1607512542884864,0.23642915524169064,0.4064569475358951,2,1,1,plateau,1.1,0.9,0.10829652780814047,24,3,2.392649157903331e-05,[0.6830858494291612],[1.041056139291905],0.6830858494291612,0.6830858494291612,0.0,COMPLETE
187,0.4964128454845234,2026-05-03 08:31:28.887840,2026-05-03 08:31:51.164107,0 days 00:00:22.276267,64,True,48,0.20084622477254432,,10,192,0.03516009006075746,0.0007720171770489642,ce,0.8601508979534567,0.16170905060865315,0.19893865282943868,0.3904962198539661,2,1,1,plateau,1.1,0.9,0.10590568557010971,24,3,0.00010374799038325081,,,,,,PRUNED
188,0.5237534265137462,2026-05-03 08:31:51.290995,2026-05-03 08:32:28.189677,0 days 00:00:36.898682,64,True,80,0.20962184041731155,,10,192,0.032405942320584476,0.0006646841373758475,ce,0.8187995901513176,0.15795391859109323,0.22157996339938998,0.4015192577380257,2,1,1,plateau,1.1,0.9,0.11120956706344044,24,3,3.605536548380911e-05,,,,,,PRUNED
189,0.4695084898071032,2026-05-03 08:32:28.293557,2026-05-03 08:32:58.168917,0 days 00:00:29.875360,64,False,80,0.30101098060168785,,8,192,0.04155459456065565,0.0008177162927514775,ce,0.6340471026368014,0.16740905795768737,0.21102505739492908,0.4130907325015444,2,3,2,plateau,1.1,0.9,0.10020737065991386,24,3,5.120116546625718e-05,,,,,,PRUNED
190,0.5613020581263399,2026-05-03 08:32:58.270103,2026-05-03 08:33:42.984600,0 days 00:00:44.714497,64,True,48,0.2194849164553211,,6,192,0.03374017706142548,0.0008617596525439219,ce,0.768713594752959,0.14711524955162067,0.22813373161780778,0.216621975226351,2,1,1,plateau,1.1,0.9,0.11614095478862979,24,3,2.06347334567141e-05,,,,,,PRUNED
191,0.4616630004039155,2026-05-03 08:33:43.087472,2026-05-03 08:34:08.585087,0 days 00:00:25.497615,64,True,64,0.30090354766571503,1.7869564688779085,10,192,0.041415625975186734,0.00037244887952091215,focal,0.6700078500898005,0.15377841682540846,0.23902347464526102,0.37876067571349026,3,3,3,plateau,1.1,0.9,0.12583946606506835,28,2,5.126346578224658e-05,,,,,,PRUNED
192,0.5153026972279425,2026-05-03 08:34:08.684481,2026-05-03 08:34:38.891273,0 days 00:00:30.206792,64,True,80,0.2054591849816221,,10,192,0.029757309803983084,0.0007511110002649018,ce,0.8834645630033182,0.18119920058632108,0.24622323700461518,0.49984031088932124,1,1,1,warmup_cosine,1.1,0.9,0.10886433612208371,24,4,2.433106896760544e-05,,,,,,PRUNED
193,0.5970486819637529,2026-05-03 08:34:38.994883,2026-05-03 08:35:38.957230,0 days 00:00:59.962347,64,True,80,0.2009558965038465,,10,192,0.036495937033891396,0.0007083185845235156,ce,0.9550238979976251,0.17352290997173658,0.2845500225266955,0.4065330867517807,1,1,1,warmup_cosine,1.1,0.9,0.0007128593666731985,24,3,2.576010894594557e-05,,,,,,PRUNED
194,0.49196672120299073,2026-05-03 08:35:39.065871,2026-05-03 08:36:02.602403,0 days 00:00:23.536532,64,True,80,0.21353462477360266,,10,192,0.03805386796195422,0.0008081954954196049,ce,0.8300888886809623,0.20446417658619898,0.2338229947269389,0.4176482955501333,2,1,1,warmup_cosine,1.1,0.9,0.048513435851776754,16,3,8.105407892523142e-05,,,,,,PRUNED
195,0.5837160323122899,2026-05-03 08:36:02.712575,2026-05-03 08:36:52.943399,0 days 00:00:50.230824,64,True,80,0.20786614595017003,,10,192,0.07269789943587776,0.0007717535640939555,ce,1.4285729490182022,0.29943426760294073,0.2529018947050021,0.426372548302602,2,1,1,warmup_invsqrt,1.1,0.9,0.13085050086654743,20,4,2.360117817099736e-05,,,,,,PRUNED
196,0.6743462777214982,2026-05-03 08:36:53.040463,2026-05-03 08:39:38.154488,0 days 00:02:45.114025,32,True,80,0.20021920090029263,,10,192,0.027721951935959343,0.0009296036506401556,ce,1.5239744708127687,0.1938363323365062,0.30985452158762183,0.33423774273917317,1,1,1,plateau,1.1,0.9,0.1505977628821273,24,2,2.9994073978303512e-05,[0.6743462777214982],[1.0933225469337664],0.6743462777214982,0.6743462777214982,0.0,COMPLETE
197,0.6642773145285674,2026-05-03 08:39:38.255006,2026-05-03 08:42:12.770234,0 days 00:02:34.515228,32,True,80,0.21310999398298222,,10,192,0.08276383117430104,0.0009488958674456477,ce,1.5172229568978155,0.19450073203639112,0.3067936345050805,0.32780207308155135,2,1,1,plateau,1.1,0.9,0.22265667073050804,24,2,3.1823149353476726e-05,[0.6642773145285674],[1.1328643651889096],0.6642773145285674,0.6642773145285674,0.0,COMPLETE
198,0.6728635809735294,2026-05-03 08:42:12.873942,2026-05-03 08:45:25.645536,0 days 00:03:12.771594,32,True,80,0.21634946397055232,,10,192,0.06639885192836577,0.000932940566015672,ce,1.551929048265035,0.20019625867180377,0.31385304300588446,0.34601686337530513,1,1,1,plateau,1.1,0.9,0.2157013390774762,24,2,3.382592135251941e-05,[0.6728635809735294],[1.1224408158295447],0.6728635809735294,0.6728635809735294,0.0,COMPLETE
199,0.6570010048508175,2026-05-03 08:45:25.752687,2026-05-03 08:47:40.517472,0 days 00:02:14.764785,32,True,80,0.21875968078153235,,10,192,0.07943062046743894,0.0009567949058940222,ce,1.50939961436332,0.1985157002286503,0.3100657276207577,0.3193429561702526,1,1,1,plateau,1.1,0.9,0.21305623938498217,24,2,3.148081321256777e-05,[0.6570010048508175],[1.101674129065278],0.6570010048508175,0.6570010048508175,0.0,COMPLETE
200,0.5762529751793666,2026-05-03 08:47:40.617690,2026-05-03 08:48:49.310857,0 days 00:01:08.693167,32,True,80,0.30074947435909616,,10,320,0.043700012087974,0.000932775960730618,ce,1.6067493860369424,0.21382578908243005,0.30268586485071697,0.45278422099142757,2,1,2,plateau,1.1,0.9,0.22920123777982965,24,2,5.144050344896746e-05,,,,,,PRUNED
201,0.49710204846158973,2026-05-03 08:48:49.407877,2026-05-03 08:49:16.413778,0 days 00:00:27.005901,32,True,80,0.23134622812052266,,10,192,0.06799090599719144,0.0009655783918655458,ce,1.525795603833713,0.1922125804951716,0.3178686379540938,0.3337758313606038,1,1,1,plateau,1.1,0.9,0.2097748235519589,24,2,3.392270573270507e-05,,,,,,PRUNED
202,0.5214991094344008,2026-05-03 08:49:16.525373,2026-05-03 08:49:51.380221,0 days 00:00:34.854848,32,True,80,0.21162691431724587,,10,192,0.03964738359098578,0.0009058550693443703,ce,1.5510848607168457,0.20835682438800734,0.2951721190559219,0.3383983518636633,1,1,1,plateau,1.1,0.9,0.2348096921329794,24,2,3.844434608814506e-05,,,,,,PRUNED
203,0.5601698809547243,2026-05-03 08:49:51.480556,2026-05-03 08:50:37.978908,0 days 00:00:46.498352,32,True,80,0.28772086934921026,,10,192,0.08823251142754651,0.000996592219312725,ce,1.5843782411374447,0.2030018588044634,0.30952743212828143,0.35035229403675655,1,1,1,plateau,1.1,0.9,0.2427887026496186,24,2,2.8125990525489206e-05,,,,,,PRUNED
204,0.5159479610575651,2026-05-03 08:50:38.084037,2026-05-03 08:51:12.590701,0 days 00:00:34.506664,32,True,80,0.22356739252351848,,10,192,0.061977307699756505,0.0008864166596099234,ce,1.6526852464453392,0.19350409021913567,0.32459551187739966,0.3572159354298387,1,1,1,plateau,1.1,0.9,0.22103865158679742,24,2,3.233718640607949e-05,,,,,,PRUNED
205,0.6136817599937353,2026-05-03 08:51:12.690128,2026-05-03 08:52:33.583465,0 days 00:01:20.893337,32,True,80,0.21498580139452172,,4,192,0.03406024453920508,0.0009112136965404986,ce,1.6268944330975232,0.1973820113631672,0.33214205112182904,0.30911137098246133,2,1,1,plateau,1.1,0.9,0.2023015148759631,24,2,3.0192106043390155e-05,,,,,,PRUNED
206,0.6528676420937798,2026-05-03 08:52:33.682064,2026-05-03 08:55:34.369301,0 days 00:03:00.687237,32,True,80,0.2058421526066458,,10,192,0.03692564546119402,0.0008740506145941911,ce,1.4654162003995144,0.19527136806452236,0.3019831888532054,0.3330425678114358,1,1,1,plateau,1.1,0.9,0.18473816542521226,24,2,4.21245657019591e-05,[0.6528676420937798],[1.1570519220343025],0.6528676420937798,0.6528676420937798,0.0,COMPLETE
207,0.6691211780326092,2026-05-03 08:55:34.483707,2026-05-03 08:58:04.624025,0 days 00:02:30.140318,32,False,80,0.21517052265777012,,6,192,0.05294903847816422,0.000999966168725635,ce,1.2411984125908808,0.1862805204431569,0.32295907658330936,0.3301015161612799,2,1,1,plateau,1.1,0.9,0.19701587524949424,24,2,7.240787120498833e-05,[0.6691211780326092],[1.0931186550955692],0.6691211780326092,0.6691211780326092,0.0,COMPLETE
208,0.6540328993004604,2026-05-03 08:58:04.739946,2026-05-03 09:00:08.330781,0 days 00:02:03.590835,32,False,80,0.2261528204155419,,6,192,0.05617208647542645,0.0009278734074929268,ce,1.1600256796477115,0.18377216963021772,0.31896248572751035,0.3251426697276916,2,1,1,plateau,1.1,0.9,0.19395690993720027,24,2,8.785861573142049e-05,[0.6540328993004604],[1.0794363490683283],0.6540328993004604,0.6540328993004604,0.0,COMPLETE
209,0.6486708379041288,2026-05-03 09:00:08.441621,2026-05-03 09:02:37.086142,0 days 00:02:28.644521,32,False,80,0.21475985735621295,,6,192,0.035629736575643584,0.000961407851748368,ce,1.230499702769807,0.18867990536369805,0.3416012343099127,0.3431189825264098,2,1,1,plateau,1.1,0.9,0.241249224621088,24,2,7.261525538616784e-05,[0.6486708379041288],[1.0440990124389136],0.6486708379041288,0.6486708379041288,0.0,COMPLETE
210,0.4797160723092776,2026-05-03 09:02:37.190716,2026-05-03 09:03:05.409022,0 days 00:00:28.218306,32,False,80,0.30082615570458293,,6,256,0.05190886995049156,0.0009570345346330408,ce,1.4939418670307287,0.17821708852100085,0.3260055476639304,0.343211832967522,2,1,2,plateau,1.1,0.9,0.26145150743223944,24,2,5.1364269900770704e-05,,,,,,PRUNED
211,0.6493005227812256,2026-05-03 09:03:05.514836,2026-05-03 09:05:33.750250,0 days 00:02:28.235414,32,False,80,0.22069127589070595,,6,192,0.05921748892551868,0.0009867100730135848,ce,1.7774038913503993,0.1877140949021021,0.31712637090649587,0.29206904330066363,2,1,1,plateau,1.1,0.9,0.22072276744518904,24,2,9.976769723561477e-05,[0.6493005227812256],[1.1145997647758867],0.6493005227812256,0.6493005227812256,0.0,COMPLETE
212,0.5266377243570942,2026-05-03 09:05:33.879171,2026-05-03 09:06:09.208106,0 days 00:00:35.328935,32,False,80,0.21093813143738133,,6,192,0.05172195675421251,0.0008694322757022581,ce,1.2769355562904652,0.20555803514875817,0.3071621139253168,0.32694505543275126,2,1,1,plateau,1.1,0.9,0.19363628629449925,24,2,7.575631046113e-05,,,,,,PRUNED
213,0.6663124152587664,2026-05-03 09:06:09.310459,2026-05-03 09:09:54.562507,0 days 00:03:45.252048,32,True,80,0.2067901525379746,,6,192,0.04881925567380173,0.0009994187382723798,ce,1.536020059270667,0.20095175599223852,0.3368383379531782,0.32905066872458016,2,1,1,plateau,1.1,0.9,0.2312739713096057,24,2,3.618441044751283e-05,[0.6663124152587664],[1.0974819988941402],0.6663124152587664,0.6663124152587664,0.0,COMPLETE
214,0.5872799227175028,2026-05-03 09:09:54.673023,2026-05-03 09:10:53.330012,0 days 00:00:58.656989,32,True,80,0.20672217454841554,,6,192,0.05318470760856964,0.0009444123122918108,ce,1.5844970454874483,0.16399949562314697,0.33219649532634815,0.31530088735940764,2,1,1,plateau,1.1,0.9,0.22908599174265487,24,2,3.393459040689365e-05,,,,,,PRUNED
215,0.5866088862037007,2026-05-03 09:10:53.429808,2026-05-03 09:12:15.246946,0 days 00:01:21.817138,32,True,80,0.21646516895168594,,6,192,0.04871890276887706,0.0009153520031423667,ce,1.5359122831908671,0.196329215789581,0.34116286017285136,0.3379088398385687,2,1,1,plateau,1.1,0.9,0.22805466989163314,24,2,3.683692069824619e-05,,,,,,PRUNED
216,0.6491968330281253,2026-05-03 09:12:15.351529,2026-05-03 09:14:50.609821,0 days 00:02:35.258292,32,True,80,0.20505736385320025,,6,192,0.05025356035819175,0.0008319961290157635,ce,1.3084345977614649,0.2022363274760722,0.29161619821270446,0.3574706634621588,2,1,1,plateau,1.1,0.9,0.25098376795050753,24,2,0.00012372103012974262,[0.6491968330281253],[1.0989423847312836],0.6491968330281253,0.6491968330281253,0.0,COMPLETE
217,0.49643263145734357,2026-05-03 09:14:50.716197,2026-05-03 09:15:18.125006,0 days 00:00:27.408809,32,False,80,0.20115896107551734,,6,192,0.08420370232274554,0.00016182243947431853,ce,1.712377777165456,0.1703761336701522,0.30938808962828046,0.32977041596596685,2,1,1,plateau,1.1,0.9,0.21623713268501502,24,2,2.9732418712885933e-05,,,,,,PRUNED
218,0.5078025228309241,2026-05-03 09:15:18.227880,2026-05-03 09:15:49.495371,0 days 00:00:31.267491,32,True,80,0.20931076857342487,,6,192,0.039329889610236514,0.0009876324045968367,ce,1.3683096077767245,0.18298739738075637,0.31575342054866384,0.34593532774676083,2,1,1,plateau,1.1,0.9,0.22429922041627975,24,2,4.019476731879581e-05,,,,,,PRUNED
219,0.6819181535343342,2026-05-03 09:15:49.605494,2026-05-03 09:18:55.901942,0 days 00:03:06.296448,32,True,80,0.20009062145169457,,10,192,0.04595346662957723,0.000903523831810895,ce,1.5010529105133812,0.17533169309514338,0.3307184819436909,0.30296728365802267,2,1,1,plateau,1.1,0.9,0.23850030071917766,32,2,2.838248171631268e-05,[0.6819181535343342],[1.0845860813161452],0.6819181535343342,0.6819181535343342,0.0,COMPLETE
220,0.6595169328812668,2026-05-03 09:18:56.007510,2026-05-03 09:21:15.546683,0 days 00:02:19.539173,32,True,80,0.20022452833405935,,10,192,0.04679971609694535,0.000922372546391821,ce,1.552436272718989,0.2830136926480179,0.3348331812887993,0.321922886081871,2,1,1,plateau,1.1,0.9,0.24728527626708086,32,2,2.813155955585943e-05,[0.6595169328812668],[1.0809960185195044],0.6595169328812668,0.6595169328812668,0.0,COMPLETE
221,0.6182290000317409,2026-05-03 09:21:15.656527,2026-05-03 09:22:45.313456,0 days 00:01:29.656929,32,True,80,0.20803638919579892,,10,192,0.04987681638729663,0.0008734361143374981,ce,1.4872332368770937,0.17516856563210292,0.35912159624905704,0.303851194078751,2,1,1,plateau,1.1,0.9,0.23292908269308185,32,2,2.6424273283417268e-05,,,,,,PRUNED
222,0.6571918178008739,2026-05-03 09:22:45.413086,2026-05-03 09:25:39.864248,0 days 00:02:54.451162,32,True,80,0.2131290782021424,,10,192,0.04551118254615215,0.0009751871123218163,ce,1.4315251153587951,0.19105722245661436,0.3252282173674587,0.31773303358808624,2,1,1,plateau,1.1,0.9,0.23402032437336623,36,2,3.522318781060412e-05,[0.6571918178008739],[1.1008124926107392],0.6571918178008739,0.6571918178008739,0.0,COMPLETE
223,0.6721247940402096,2026-05-03 09:25:39.978084,2026-05-03 09:28:46.160908,0 days 00:03:06.182824,32,True,80,0.20527382817922651,,10,192,0.04654674283528765,0.0009955017345089875,ce,1.52242149108171,0.2884475561819946,0.35128905751793843,0.3339833259087709,2,1,1,plateau,1.1,0.9,0.23848761754838943,24,2,3.1068338574901515e-05,[0.6721247940402096],[1.121419615025143],0.6721247940402096,0.6721247940402096,0.0,COMPLETE
224,0.655714087365789,2026-05-03 09:28:46.270580,2026-05-03 09:31:56.201811,0 days 00:03:09.931231,32,True,80,0.20459585945718983,,10,192,0.048026409314572464,0.0009475686529137248,ce,1.5123514930901614,0.2943043873156535,0.3491468290685106,0.3325417942279105,2,1,1,plateau,1.1,0.9,0.238062128560858,24,2,3.171296567040933e-05,[0.655714087365789],[1.1151249808944959],0.655714087365789,0.655714087365789,0.0,COMPLETE
225,0.5653740224371322,2026-05-03 09:31:56.313313,2026-05-03 09:32:43.061880,0 days 00:00:46.748567,32,True,80,0.20020204217731702,,10,192,0.045699527656123944,0.0009892015723233123,ce,1.532191036365745,0.2888577694608567,0.3261490521407939,0.3362066159476699,2,1,1,plateau,1.1,0.9,0.24175135034538164,24,2,2.8992998876693615e-05,,,,,,PRUNED
226,0.5865922200867313,2026-05-03 09:32:43.161593,2026-05-03 09:33:48.825336,0 days 00:01:05.663743,32,True,80,0.2095408693075699,,10,192,0.04572414162396268,0.0008968005325253977,ce,1.2537498758692192,0.2755626561880814,0.33507657830927584,0.35172273558920997,2,1,1,plateau,1.1,0.9,0.22578893551963625,24,2,2.4111104572098566e-05,,,,,,PRUNED
227,0.5520917743557404,2026-05-03 09:33:48.935259,2026-05-03 09:34:35.546003,0 days 00:00:46.610744,32,True,80,0.2173928875834683,,10,192,0.04394682195206552,0.000999849863058546,ce,1.4692758448767682,0.1679519081659209,0.3425455604843532,0.3226455946368062,2,1,1,plateau,1.1,0.9,0.20570649121215437,32,2,2.2047445749382413e-05,,,,,,PRUNED
228,0.5420525677755603,2026-05-03 09:34:35.646039,2026-05-03 09:35:18.285028,0 days 00:00:42.638989,32,True,80,0.20464260641833218,,10,192,0.046809225417941545,0.0008481161226470643,ce,1.572367427707802,0.2823759352977592,0.3192439169699466,0.33945176015894685,2,1,1,plateau,1.1,0.9,0.25417781635044934,24,2,0.00011572322935242609,,,,,,PRUNED
