number,value,datetime_start,datetime_complete,duration,params_batch_size,params_class_weighting,params_cnn_channels,params_dropout,params_focal_gamma,params_freq_mask_param,params_hidden_size,params_label_smoothing,params_learning_rate,params_loss_type,params_max_grad_norm,params_min_lr_ratio,params_mixup_alpha,params_mixup_prob,params_num_freq_masks,params_num_layers,params_num_time_masks,params_scheduler_type,params_speed_perturb_max,params_speed_perturb_min,params_speed_perturb_prob,params_time_mask_param,params_warmup_epochs,params_weight_decay,user_attrs_repeat_best_f1s,user_attrs_repeat_best_losses,user_attrs_repeat_mean_f1,user_attrs_repeat_robust_score,user_attrs_repeat_std_f1,state
0,0.6591563655724108,2026-05-03 05:31:27.998274,2026-05-03 05:36:11.429828,0 days 00:04:43.431554,64,True,64,0.47701814444901136,,8,192,0.13699098521619943,0.0006097839109531517,ce,0.7092407909780627,0.20296322368059488,0.21685785941408728,0.2465447373174767,3,2,3,warmup_invsqrt,1.1,0.9,0.13682099526511077,20,4,5.394455304087541e-05,[0.6591563655724108],[1.210136693587406],0.6591563655724108,0.6591563655724108,0.0,COMPLETE
1,,2026-05-03 05:36:11.551695,2026-05-03 05:37:04.433320,0 days 00:00:52.881625,64,True,80,0.32379422752781756,1.9675666141341164,6,192,0.09274563216630258,0.00011097554561103102,focal,1.3968499682166278,0.2737068376069122,0.4687496940092467,0.1353970008207678,2,1,1,warmup_invsqrt,1.1,0.9,0.058794858725743554,36,8,1.1626378306531551e-05,,,,,,FAIL
2,0.651354805683972,2026-05-03 05:37:12.292330,2026-05-03 05:41:54.600564,0 days 00:04:42.308234,64,True,64,0.47701814444901136,,8,192,0.13699098521619943,0.0006097839109531517,ce,0.7092407909780627,0.20296322368059488,0.21685785941408728,0.2465447373174767,3,2,3,warmup_invsqrt,1.1,0.9,0.13682099526511077,20,4,5.394455304087541e-05,[0.651354805683972],[1.2226235797936968],0.651354805683972,0.651354805683972,0.0,COMPLETE
3,0.5863104160570766,2026-05-03 05:41:54.719237,2026-05-03 05:46:18.015844,0 days 00:04:23.296607,64,True,80,0.32379422752781756,1.9675666141341164,6,192,0.09274563216630258,0.00011097554561103102,focal,1.3968499682166278,0.2737068376069122,0.4687496940092467,0.1353970008207678,2,1,1,warmup_invsqrt,1.1,0.9,0.058794858725743554,36,8,1.1626378306531551e-05,[0.5863104160570766],[0.6754768789529229],0.5863104160570766,0.5863104160570766,0.0,COMPLETE
4,0.624825670208277,2026-05-03 05:46:18.127646,2026-05-03 05:50:47.042281,0 days 00:04:28.914635,32,False,80,0.47671433596190427,1.6738035892876946,10,256,0.11712703466859459,0.0005167075260023275,focal,1.4563362070328196,0.232401544584516,0.4548850970305306,0.28888597006477973,3,3,4,plateau,1.1,0.9,0.035878273781490506,32,4,0.0007360091638366148,[0.624825670208277],[0.6902189782197526],0.624825670208277,0.624825670208277,0.0,COMPLETE
5,0.5235994668268074,2026-05-03 05:50:47.153295,2026-05-03 05:55:05.498017,0 days 00:04:18.344722,64,False,64,0.3888877846357622,,8,192,0.02615839278630344,0.00012884035848463504,ce,1.3090133628734761,0.27313974962249443,0.422976062065625,0.45843651996939727,1,1,3,warmup_invsqrt,1.1,0.9,0.09540104249155916,40,3,2.7253576171305756e-05,[0.5235994668268074],[1.2727232096578291],0.5235994668268074,0.5235994668268074,0.0,COMPLETE
6,0.35916934978415543,2026-05-03 05:55:05.602197,2026-05-03 05:55:30.788875,0 days 00:00:25.186678,64,False,48,0.5429455206802403,,12,256,0.06517822958253641,0.00017460443532333516,ce,0.8593428360004587,0.2770664714916634,0.15795794883648925,0.2957811041110252,3,2,2,plateau,1.1,0.9,0.2956951362331802,40,3,0.0017412787871290505,,,,,,PRUNED
7,0.666852269509431,2026-05-03 05:55:30.886945,2026-05-03 05:58:52.038310,0 days 00:03:21.151365,32,False,48,0.20414695723196405,,10,192,0.03811966201583504,0.000359087933424032,ce,1.8160090300714715,0.2811734045696407,0.20317665108606225,0.3639936184136716,3,3,1,plateau,1.1,0.9,0.24516666006036475,40,2,9.431030984067029e-05,[0.666852269509431],[1.0905859032266145],0.666852269509431,0.666852269509431,0.0,COMPLETE
8,0.6270530325123312,2026-05-03 05:58:52.138827,2026-05-03 06:02:01.551866,0 days 00:03:09.413039,32,True,80,0.42463854713176985,1.507592375769328,12,192,0.020735764129330373,0.00045458268795291895,focal,0.9880995472389016,0.10931227187420002,0.3985965620472097,0.35985315961888587,1,1,2,plateau,1.1,0.9,0.2547670231482534,20,6,0.00014259000073698732,[0.6270530325123312],[0.6527740998233823],0.6270530325123312,0.6270530325123312,0.0,COMPLETE
9,0.3438394975916145,2026-05-03 06:02:01.654605,2026-05-03 06:02:27.625842,0 days 00:00:25.971237,64,False,64,0.37019309061021394,2.930892865503881,6,192,0.10454722959071677,0.00020745409176835388,focal,1.7795141832010402,0.2909049942723132,0.2177795568278343,0.2540390914407701,3,3,4,warmup_invsqrt,1.1,0.9,0.25534100145505706,40,8,5.4692231235925465e-05,,,,,,PRUNED
10,0.3310488493092671,2026-05-03 06:02:27.723391,2026-05-03 06:03:09.268098,0 days 00:00:41.544707,32,True,64,0.37339796106612333,2.2670135982914066,14,256,0.12101133946791809,0.000292144704206099,focal,1.063374428959916,0.13449878921288394,0.1375927759363476,0.3313120563984696,2,2,3,warmup_cosine,1.1,0.9,0.010782682139022625,20,8,0.0009899542627616385,,,,,,PRUNED
11,0.6477208214918297,2026-05-03 06:03:09.367066,2026-05-03 06:07:25.983395,0 days 00:04:16.616329,32,False,48,0.3044904689037049,,16,320,0.06239808865407698,0.0008621083988008804,ce,1.9187145799605694,0.05711957278499297,0.3320150460092073,0.49390700555696965,4,3,2,warmup_cosine,1.1,0.9,0.20253186700453746,48,2,0.00021744146672792806,[0.6477208214918297],[1.2888551447317182],0.6477208214918297,0.6477208214918297,0.0,COMPLETE
12,0.3926523826946951,2026-05-03 06:07:26.087451,2026-05-03 06:07:57.423983,0 days 00:00:31.336532,32,True,48,0.4929810030950178,,10,320,0.0654575813130022,0.000346988621376383,ce,0.5383242422158152,0.21145098079640537,0.25638093229196685,0.17317202929318454,4,2,4,plateau,1.1,0.9,0.17510702291073849,28,6,0.00012014311843979998,,,,,,PRUNED
13,0.6515472140538089,2026-05-03 06:07:57.525153,2026-05-03 06:10:54.865257,0 days 00:02:57.340104,32,False,48,0.20627367310914538,,4,192,0.04290008075886986,0.0009542155721709485,ce,1.498584673728871,0.17452694633771249,0.1018960478612359,0.40317843636064027,2,3,1,warmup_invsqrt,1.1,0.9,0.13394815281763028,16,2,2.8950652640956647e-05,[0.6515472140538089],[1.1087979853010292],0.6515472140538089,0.6515472140538089,0.0,COMPLETE
14,0.3592149713622826,2026-05-03 06:10:54.962189,2026-05-03 06:11:19.185438,0 days 00:00:24.223249,64,True,64,0.5232302002744974,,8,192,0.08235297741089986,0.00032146785939629553,ce,1.6844491206497907,0.23147509987125747,0.30684806174238505,0.19790021357715396,4,2,3,plateau,1.1,0.9,0.20308937927469228,48,5,0.0003655252205672666,,,,,,PRUNED
15,0.6632172510959659,2026-05-03 06:11:19.282552,2026-05-03 06:14:36.857102,0 days 00:03:17.574550,64,True,48,0.2062071341012412,,10,192,0.042748814948177886,0.0007396382985156567,ce,1.128105755229308,0.15526319949229803,0.20398969206743092,0.40277518943096224,2,3,1,warmup_cosine,1.1,0.9,0.10410715614135044,28,3,6.248630538864287e-05,[0.6632172510959659],[1.2132500870336447],0.6632172510959659,0.6632172510959659,0.0,COMPLETE
16,0.48742773849404797,2026-05-03 06:14:36.957253,2026-05-03 06:15:23.288972,0 days 00:00:46.331719,32,False,48,0.30801091791737395,,12,320,0.048796388409564205,0.00023196643525095237,ce,1.100267654115198,0.13889126100413612,0.2630617361066807,0.39883503976436663,2,3,2,warmup_cosine,1.1,0.9,0.09127215560355811,28,2,0.00011913552809314298,,,,,,PRUNED
17,0.6745341342849124,2026-05-03 06:15:23.386174,2026-05-03 06:18:01.852596,0 days 00:02:38.466422,64,True,48,0.21251471540938785,,10,192,0.035694411471115496,0.000726512454277353,ce,1.640497905509838,0.16732296250299175,0.16881747986526147,0.4260345463106313,2,3,1,warmup_cosine,1.1,0.9,0.09331384959970355,32,3,2.791415903634122e-05,[0.6745341342849124],[1.0913404077648832],0.6745341342849124,0.6745341342849124,0.0,COMPLETE
18,0.48777556726133364,2026-05-03 06:18:01.954182,2026-05-03 06:18:43.464506,0 days 00:00:41.510324,32,False,48,0.2510660857637191,,10,192,0.03252472723371368,0.0004159988698189926,ce,1.9792815217040298,0.08971645594993555,0.17262552009827856,0.4480396845515318,1,3,1,warmup_cosine,1.1,0.9,0.23326943552717977,32,3,1.1173843800730351e-05,,,,,,PRUNED
19,0.49214490437561076,2026-05-03 06:18:43.567463,2026-05-03 06:19:29.693428,0 days 00:00:46.125965,32,False,48,0.3343749224990295,,14,256,0.05485560180943806,0.0006528628397347459,ce,1.6349683734815608,0.23874602296876965,0.10219642567244393,0.3594141628723901,4,3,2,plateau,1.1,0.9,0.2947993748261999,44,2,0.00040434071231254857,,,,,,PRUNED
20,0.34842793962887975,2026-05-03 06:19:29.792095,2026-05-03 06:19:57.013243,0 days 00:00:27.221148,64,True,48,0.43740321959959594,,14,320,0.07602366896968946,0.0002587465585437731,ce,1.7836341160352354,0.17550057577184058,0.372172614963601,0.44530584852036226,3,3,2,warmup_cosine,1.1,0.9,0.1799191380368904,36,5,0.00022508018364344692,,,,,,PRUNED
21,0.4025991699549994,2026-05-03 06:19:57.140434,2026-05-03 06:20:26.476621,0 days 00:00:29.336187,64,True,48,0.23436644436003068,,6,192,0.03639905206028112,0.000390770178052116,ce,1.6093696648549944,0.1040832823798985,0.2715107692738613,0.3596901815804933,2,3,1,warmup_cosine,1.1,0.9,0.06837394791635283,32,6,2.3888879825564538e-05,,,,,,PRUNED
22,0.670343420077879,2026-05-03 06:20:26.576013,2026-05-03 06:23:04.014599,0 days 00:02:37.438586,64,True,48,0.20166563583172847,,10,192,0.0416160537609131,0.0007635244668116181,ce,1.231810780053671,0.1699959315279057,0.18780245220698563,0.4068802642247304,2,3,1,warmup_cosine,1.1,0.9,0.09705263243578155,24,3,7.964885851805192e-05,[0.670343420077879],[1.0943199726317425],0.670343420077879,0.670343420077879,0.0,COMPLETE
23,0.6680837367182847,2026-05-03 06:23:04.117635,2026-05-03 06:26:33.906995,0 days 00:03:29.789360,64,True,48,0.24489503402306995,,10,192,0.033099127246303525,0.0007806264560104255,ce,1.2617921279786817,0.1776434556753128,0.1865975750564854,0.4158714265068949,2,3,1,warmup_cosine,1.1,0.9,0.10956248855076545,24,3,1.8314869288091946e-05,[0.6680837367182847],[1.2110660239089308],0.6680837367182847,0.6680837367182847,0.0,COMPLETE
24,0.4738259518669699,2026-05-03 06:26:34.010945,2026-05-03 06:27:07.151149,0 days 00:00:33.140204,64,True,48,0.2597693976571276,,10,192,0.030388773317079842,0.0008284223286209447,ce,1.2341072832755393,0.1754166067239517,0.14296880780911184,0.4903656703775231,2,3,1,warmup_cosine,1.1,0.9,0.11389923537939098,24,4,1.7965509743166766e-05,,,,,,PRUNED
25,0.4963488713300066,2026-05-03 06:27:07.254605,2026-05-03 06:27:40.621827,0 days 00:00:33.367222,64,True,48,0.23042448425083095,,10,192,0.051880407078112825,0.0005226007274130995,ce,1.2479049505624382,0.1537709825768468,0.17561234187818797,0.42142786645638375,2,3,1,warmup_cosine,1.1,0.9,0.07302837018962233,24,3,1.692366664907366e-05,,,,,,PRUNED
26,0.6672200206628818,2026-05-03 06:27:40.716508,2026-05-03 06:30:00.873340,0 days 00:02:20.156832,64,True,80,0.2706753982735518,,8,192,0.025963109495514294,0.0007105671368735439,ce,0.9305869646964495,0.1911457887908175,0.24399148291414402,0.43230300310560665,1,1,1,warmup_cosine,1.1,0.9,0.03837425675436559,24,5,3.4113819281573854e-05,[0.6672200206628818],[0.9974713368381528],0.6672200206628818,0.6672200206628818,0.0,COMPLETE
27,0.5486173935567383,2026-05-03 06:30:00.977837,2026-05-03 06:30:55.282471,0 days 00:00:54.304634,64,True,48,0.2294039729106461,2.978665163574606,8,192,0.042708679202389396,0.0008995313199041108,focal,1.362610731014387,0.13074588163358053,0.13584905435062958,0.4732299850279781,2,3,1,warmup_cosine,1.1,0.9,0.16200823484304622,24,3,3.584835708688897e-05,,,,,,PRUNED
28,0.4580726499212617,2026-05-03 06:30:55.379675,2026-05-03 06:31:24.779342,0 days 00:00:29.399667,64,True,48,0.27213360711342505,,10,192,0.021007235334172935,0.0005263731795260392,ce,1.50965484585108,0.15980883375322977,0.3001908750701043,0.3823687708335534,2,3,1,warmup_cosine,1.1,0.9,0.11940257982424952,28,4,1.8954455566250775e-05,,,,,,PRUNED
29,0.4307388286982689,2026-05-03 06:31:24.881530,2026-05-03 06:31:52.301559,0 days 00:00:27.420029,64,True,48,0.32125583680643693,,12,256,0.05431635294412835,0.000979316528209219,ce,1.2327597353664785,0.18192568319316876,0.1905659141827708,0.3332701452984229,2,3,2,warmup_cosine,1.1,0.9,0.07729101950356444,28,7,7.26734948844195e-05,,,,,,PRUNED
30,0.4551234421079926,2026-05-03 06:31:52.399621,2026-05-03 06:32:16.346909,0 days 00:00:23.947288,64,True,80,0.34253701785691354,,12,320,0.05946170797816555,0.000761007510256593,ce,0.8580625605789569,0.2161604632092044,0.11962618691974225,0.31758147514539414,3,1,2,warmup_cosine,1.1,0.9,0.04277070827088504,24,4,7.763251933856707e-05,,,,,,PRUNED
31,0.5133685192373358,2026-05-03 06:32:16.450689,2026-05-03 06:32:49.481666,0 days 00:00:33.030977,64,True,48,0.2870878002512922,,8,192,0.03780185317382979,0.0006457866843831814,ce,1.1399267632484749,0.10995983977409304,0.22375313619505213,0.4222464699952396,1,3,1,warmup_cosine,1.1,0.9,0.007920889534355532,16,3,4.463717591656636e-05,,,,,,PRUNED
32,0.660686165128721,2026-05-03 06:32:49.590849,2026-05-03 06:35:16.016853,0 days 00:02:26.426004,64,True,80,0.24351642628834264,,8,192,0.028292324379096033,0.0007440225603690419,ce,0.964722283443144,0.195858736548892,0.2277053990015378,0.4305276349318435,1,1,1,warmup_cosine,1.1,0.9,0.03220323147464481,24,5,3.846214452271409e-05,[0.660686165128721],[1.0741076280744812],0.660686165128721,0.660686165128721,0.0,COMPLETE
33,0.6760615636736028,2026-05-03 06:35:16.116324,2026-05-03 06:38:15.624404,0 days 00:02:59.508080,64,True,80,0.2207364076733743,,6,192,0.02575799824464036,0.0006071198659602965,ce,0.6742883600758249,0.196620220973635,0.24324685329079893,0.4738536502890335,1,1,1,warmup_cosine,1.1,0.9,0.14890746124755522,20,4,1.4678258143962294e-05,[0.6760615636736028],[1.0651939108217363],0.6760615636736028,0.6760615636736028,0.0,COMPLETE
34,0.4291860161889891,2026-05-03 06:38:15.727714,2026-05-03 06:38:42.393187,0 days 00:00:26.665473,64,True,80,0.21152432031491014,,4,192,0.046922963675294506,0.0005794114296058977,ce,0.6277707525614519,0.25341714981276847,0.17487770324565038,0.46374387166204406,1,1,1,warmup_cosine,1.1,0.9,0.13963329656470047,20,4,1.3577121488086378e-05,,,,,,PRUNED
35,0.6607294671775684,2026-05-03 06:38:42.492352,2026-05-03 06:41:49.347497,0 days 00:03:06.855145,64,True,80,0.22072507547170617,,6,192,0.03550335543677558,0.0005722174167119119,ce,0.7177238146108822,0.20731751050077335,0.28132969574439326,0.4989799257350453,2,1,1,warmup_cosine,1.1,0.9,0.12448477508490405,20,4,2.2285487436614608e-05,[0.6607294671775684],[1.1290367281408333],0.6607294671775684,0.6607294671775684,0.0,COMPLETE
36,0.46313581430090595,2026-05-03 06:41:49.459348,2026-05-03 06:42:15.808846,0 days 00:00:26.349498,64,True,80,0.22251836179560433,2.545738644747745,6,192,0.024719267193850824,0.0006522079227978676,focal,0.7561132059078339,0.16135146199309525,0.49619285277544434,0.39055365894949445,2,1,1,warmup_invsqrt,1.1,0.9,0.14783118733832087,16,3,1.0051441608168645e-05,,,,,,PRUNED
37,0.5477495527366592,2026-05-03 06:42:15.906406,2026-05-03 06:42:55.634175,0 days 00:00:39.727769,64,True,64,0.24414942916384186,,10,192,0.032497461017591676,0.00045240333996719056,ce,0.5002210037115888,0.21986849889309348,0.23718246019817107,0.4734264496529605,1,1,1,warmup_cosine,1.1,0.9,0.0937352151974674,32,3,1.4223830487406019e-05,,,,,,PRUNED
38,0.4860425775534698,2026-05-03 06:42:55.730582,2026-05-03 06:43:24.216039,0 days 00:00:28.485457,64,True,80,0.3116925679776863,,12,192,0.04791802020170882,0.0008228005592208836,ce,1.4098659789261,0.19731328160949346,0.19365337426797874,0.4472674886870687,3,2,4,warmup_cosine,1.1,0.9,0.161728042727556,24,2,6.150066864305918e-05,,,,,,PRUNED
39,0.4595740912732621,2026-05-03 06:43:24.313227,2026-05-03 06:43:51.483576,0 days 00:00:27.170349,64,True,48,0.3110482893171184,2.484320866879835,14,256,0.07140710249424978,0.0004874547214650528,focal,1.5253157412963194,0.14522268534830635,0.1549670082587415,0.3788343393244472,3,3,3,warmup_invsqrt,1.1,0.9,0.05868410318799767,36,4,7.799269062841118e-05,,,,,,PRUNED
40,0.6463066453485347,2026-05-03 06:43:51.582886,2026-05-03 06:46:00.944327,0 days 00:02:09.361441,64,True,80,0.21807381484178062,,4,192,0.040753884859831516,0.0005695103847541919,ce,1.3589822701043546,0.12559314853709203,0.2008774936832386,0.11422588609786014,2,1,1,warmup_cosine,1.1,0.9,0.107146252099514,20,3,1.4274274557907179e-05,[0.6463066453485347],[1.1024156154202613],0.6463066453485347,0.6463066453485347,0.0,COMPLETE
41,0.4010594072240771,2026-05-03 06:46:01.049620,2026-05-03 06:46:27.419153,0 days 00:00:26.369533,64,True,64,0.3232405442455649,,16,192,0.10278343553268396,0.00016427711253799243,ce,0.8047134755309263,0.2500023845423432,0.3418849713594899,0.2708635235196649,3,3,2,warmup_cosine,1.1,0.9,0.0908294030726354,28,4,5.959378101540663e-05,,,,,,PRUNED
42,0.46947044446508357,2026-05-03 06:46:27.524554,2026-05-03 06:46:50.844051,0 days 00:00:23.319497,64,True,80,0.27214311788672213,,8,192,0.025179058924599,0.0007072833768970458,ce,1.0009153549376553,0.16886980921460287,0.22994830955070872,0.4226280365869774,1,1,1,warmup_cosine,1.1,0.9,0.04639453929339822,24,5,3.400495734206307e-05,,,,,,PRUNED
43,0.6558278406019021,2026-05-03 06:46:50.940818,2026-05-03 06:49:37.974609,0 days 00:02:47.033791,64,True,80,0.20046284174944376,,10,192,0.028996909910890944,0.0008030092579714054,ce,0.911191799886052,0.1875998468781409,0.251731627318558,0.4348151920774069,1,1,1,warmup_cosine,1.1,0.9,0.018812908287961394,20,4,2.65942271809443e-05,[0.6558278406019021],[1.113419159710836],0.6558278406019021,0.6558278406019021,0.0,COMPLETE
44,0.46173798132146576,2026-05-03 06:49:38.077150,2026-05-03 06:50:04.663010,0 days 00:00:26.585860,64,True,80,0.2545278939069238,,8,192,0.020555598527659803,0.0006923876140924025,ce,0.6591603333949152,0.1864879068993237,0.2428975435752848,0.46484597585001075,1,1,1,warmup_cosine,1.1,0.9,0.13018376580581575,24,5,2.110063411189658e-05,,,,,,PRUNED
45,0.38349585782474727,2026-05-03 06:50:04.759940,2026-05-03 06:50:28.035828,0 days 00:00:23.275888,64,True,80,0.2695317959696219,,8,192,0.03335998432306006,0.0001040282230981105,ce,0.5982150392834438,0.18674431241714273,0.2822286997097989,0.4141776416715136,1,1,1,warmup_cosine,1.1,0.9,0.057564369315542825,32,6,3.0582711723977415e-05,,,,,,PRUNED
46,0.5089385950782989,2026-05-03 06:50:28.131840,2026-05-03 06:50:57.803766,0 days 00:00:29.671926,64,True,80,0.28793435266161815,1.934473465428852,6,192,0.024990427027777935,0.0009014218113269199,focal,1.2953108114151641,0.19875818691992678,0.20959270781209657,0.33856219181114666,1,1,1,warmup_invsqrt,1.1,0.9,0.08074180088706787,20,4,1.507230467476074e-05,,,,,,PRUNED
47,0.48688251607794475,2026-05-03 06:50:57.909193,2026-05-03 06:51:26.405727,0 days 00:00:28.496534,64,True,48,0.3072564999780557,,8,256,0.04547920959416795,0.0009915937413968838,ce,1.1941572237795752,0.22822666868864003,0.1589453490314593,0.47767185514769883,3,2,3,plateau,1.1,0.9,0.1563001078625727,28,5,5.5958539632998384e-05,,,,,,PRUNED
48,0.4901036360608442,2026-05-03 06:51:26.501542,2026-05-03 06:52:00.466792,0 days 00:00:33.965250,64,True,64,0.3090208350487528,,10,192,0.05087534906706845,0.0006012089362179314,ce,1.0164298853531637,0.14861396284728393,0.18365956560641153,0.4492260963191855,2,3,2,warmup_cosine,1.1,0.9,0.18211286276047753,24,2,5.557841929676286e-05,,,,,,PRUNED
49,0.41806626471572955,2026-05-03 06:52:00.564551,2026-05-03 06:52:25.537269,0 days 00:00:24.972718,64,True,48,0.4190209796753455,,8,320,0.04439435844901806,0.000688679090670534,ce,0.8976451576637696,0.17078278453403353,0.1585660982182473,0.37081401510379397,2,2,4,warmup_cosine,1.1,0.9,0.10339026030126094,28,3,9.413957863703462e-05,,,,,,PRUNED
50,0.4519332935248897,2026-05-03 06:52:25.632533,2026-05-03 06:52:51.950263,0 days 00:00:26.317730,64,False,80,0.34301580961333533,2.695499862229448,12,192,0.05796671863397164,0.0007726641221815486,focal,1.8695388719684158,0.20806610052948726,0.3214101616400068,0.4007454361431705,2,3,2,warmup_cosine,1.1,0.9,0.030261332606286946,44,3,6.848718303929253e-05,,,,,,PRUNED
51,0.5581232518467104,2026-05-03 06:52:52.050961,2026-05-03 06:53:43.177640,0 days 00:00:51.126679,32,True,48,0.23979792711299683,,10,192,0.03934477755583979,0.00047225264635408196,ce,1.7052311862275726,0.12190168155967357,0.2129432231825143,0.2071258519773836,1,1,1,plateau,1.1,0.9,0.19644244758765844,16,2,4.4347758399002765e-05,,,,,,PRUNED
52,0.5472023430765048,2026-05-03 06:53:43.274074,2026-05-03 06:54:38.248211,0 days 00:00:54.974137,32,False,48,0.2003168337718724,,10,192,0.03486622033487909,0.00035493263125043004,ce,1.8388136188408473,0.2929209844039366,0.2509012724047161,0.3500401795520082,1,3,1,plateau,1.1,0.9,0.23445950139977362,36,2,0.00016731108544060122,,,,,,PRUNED
53,0.47446038793208334,2026-05-03 06:54:38.356752,2026-05-03 06:55:15.298755,0 days 00:00:36.942003,32,False,48,0.21465762356732163,,10,192,0.030108107277978045,0.0001365492301978717,ce,1.740034300989711,0.27872670402561345,0.13064796391680816,0.3064584899763223,1,3,1,plateau,1.1,0.9,0.2872757002950599,20,2,9.172727427991651e-05,,,,,,PRUNED
